{
    "id": "2df9c6fb1edabeb1f548aae812baa889",
    "metadata": {
        "id": "2df9c6fb1edabeb1f548aae812baa889",
        "url": "https://eugeneyan.com/writing/llm-patterns/",
        "title": "Patterns for Building LLM-based Systems & Products",
        "properties": {
            "description": "Evals, RAG, fine-tuning, caching, guardrails, defensive UX, and collecting user feedback.",
            "keywords": null,
            "author": "Eugene Yan",
            "og:site_name": "eugeneyan.com",
            "og:title": "Patterns for Building LLM-based Systems & Products",
            "og:type": "article",
            "og:description": "Evals, RAG, fine-tuning, caching, guardrails, defensive UX, and collecting user feedback.",
            "og:url": "https://eugeneyan.com/writing/llm-patterns/",
            "og:image": "https://eugeneyan.com/assets/og_image/llm-patterns-og.png",
            "twitter:card": "summary_large_image",
            "twitter:domain": "eugeneyan.com",
            "twitter:title": "Patterns for Building LLM-based Systems & Products",
            "twitter:description": "Evals, RAG, fine-tuning, caching, guardrails, defensive UX, and collecting user feedback.",
            "twitter:image": "https://eugeneyan.com/assets/og_image/llm-patterns-og.png"
        }
    },
    "parent_metadata": {
        "id": "e07c70bdee06646db6fa58ce5cdc9d18",
        "url": "https://www.notion.so/LLMs-e07c70bdee06646db6fa58ce5cdc9d18",
        "title": "LLMs",
        "properties": {
            "Type": "Leaf"
        }
    },
    "content": "# [eugeneyan](/)\n\n  * [Start Here](/start-here/ \"Start Here\")\n  * [Writing](/writing/ \"Writing\")\n  * [Speaking](/speaking/ \"Speaking\")\n  * [Prototyping](/prototyping/ \"Prototyping\")\n  * [About](/about/ \"About\")\n\n\n\n# Patterns for Building LLM-based Systems & Products\n\n[ [llm](/tag/llm/) [engineering](/tag/engineering/) [production](/tag/production/) [üî•](/tag/üî•/) ]  ¬∑ 66 min read \n\n> Discussions on [HackerNews](https://news.ycombinator.com/item?id=36965993), [Twitter](https://twitter.com/eugeneyan/status/1686531758701899776), and [LinkedIn](https://www.linkedin.com/posts/eugeneyan_patterns-for-building-llm-based-systems-activity-7092300473981927424-_wVo)\n\n‚ÄúThere is a large class of problems that are easy to imagine and build demos for, but extremely hard to make products out of. For example, self-driving: It‚Äôs easy to demo a car self-driving around a block, but making it into a product takes a decade.‚Äù - [Karpathy](https://twitter.com/eugeneyan/status/1672692174704766976)\n\nThis write-up is about practical patterns for integrating large language models (LLMs) into systems & products. We‚Äôll build on academic research, industry resources, and practitioner know-how, and distill them into key ideas and practices.\n\nThere are seven key patterns. They‚Äôre also organized along the spectrum of improving performance vs. reducing cost/risk, and closer to the data vs. closer to the user.\n\n  * [Evals](#evals-to-measure-performance): To measure performance\n  * [RAG](#retrieval-augmented-generation-to-add-knowledge): To add recent, external knowledge\n  * [Fine-tuning](#fine-tuning-to-get-better-at-specific-tasks): To get better at specific tasks\n  * [Caching](#caching-to-reduce-latency-and-cost): To reduce latency & cost\n  * [Guardrails](#guardrails-to-ensure-output-quality): To ensure output quality\n  * [Defensive UX](#defensive-ux-to-anticipate--handle-errors-gracefully): To anticipate & manage errors gracefully\n  * [Collect user feedback](#collect-user-feedback-to-build-our-data-flywheel): To build our data flywheel\n\n\n\n(Also see this addendum on [how to match these LLM patterns to potential problems](/writing/llm-problems/).)\n\n![Image](/assets/llm-patterns-og.png)\n\nLLM patterns: From data to user, from defensive to offensive ([see connections between patterns](#conclusion))\n\n## Evals: To measure performance[](#evals-to-measure-performance)\n\nEvaluations are a set of measurements used to assess a model‚Äôs performance on a task. They include benchmark data and metrics. From a [HackerNews comment](https://news.ycombinator.com/item?id=36789901):\n\n> How important evals are to the team is a major differentiator between folks rushing out hot garbage and those seriously building products in the space.\n\n### Why evals?[](#why-evals)\n\nEvals enable us to measure how well our system or product is doing and detect any regressions. (A system or product can be made up of multiple components such as LLMs, prompt templates, retrieved context, and parameters like temperature.) A representative set of evals takes us a step towards measuring system changes at scale. Without evals, we would be flying blind, or would have to visually inspect LLM outputs with each change.\n\n### More about evals[](#more-about-evals)\n\n**There are many benchmarks in the field of language modeling**. Some notable ones are:\n\n  * **[MMLU](https://arxiv.org/abs/2009.03300)** : A set of 57 tasks that span elementary math, US history, computer science, law, and more. To perform well, models must possess extensive world knowledge and problem-solving ability.\n  * **[EleutherAI Eval](https://github.com/EleutherAI/lm-evaluation-harness)** : Unified framework to test models via zero/few-shot settings on 200 tasks. Incorporates a large number of evals including BigBench, MMLU, etc.\n  * **[HELM](https://arxiv.org/abs/2211.09110)** : Instead of specific tasks and metrics, HELM offers a comprehensive assessment of LLMs by evaluating them across domains. Metrics include accuracy, calibration, robustness, fairness, bias, toxicity, etc. Tasks include Q&A, information retrieval, summarization, text classification, etc.\n  * **[AlpacaEval](https://github.com/tatsu-lab/alpaca_eval)** : Automated evaluation framework which measures how often a strong LLM (e.g., GPT-4) prefers the output of one model over a reference model. Metrics include win rate, bias, latency, price, variance, etc. Validated to have high agreement with 20k human annotations.\n\n\n\nWe can group metrics into two categories: context-dependent or context-free.\n\n  * **Context-dependent** : These take context into account. They‚Äôre often proposed for a specific task; repurposing them for other tasks will require some adjustment.\n  * **Context-free** : These aren‚Äôt tied to the context when evaluating generated output; they only compare the output with the provided gold references. As they‚Äôre task agnostic, they‚Äôre easier to apply to a wide variety of tasks.\n\n\n\nTo get a better sense of these metrics (and their potential shortfalls), we‚Äôll explore a few of the commonly used metrics such as BLEU, ROUGE, BERTScore, and MoverScore.\n\n**[BLEU](https://dl.acm.org/doi/10.3115/1073083.1073135) (Bilingual Evaluation Understudy)** is a precision-based metric: It counts the number of n-grams in the generated output that also show up in the reference, and then divides it by the total number of words in the output. It‚Äôs predominantly used in machine translation and remains a popular metric due to its cost-effectiveness.\n\nFirst, precision for various values of n is computed:\n\nprecisionn=‚àëp‚ààoutput‚àën-gram‚ààpCountclip(n-gram)‚àëp‚ààoutput‚àën-gram‚ààpCount(n-gram)\n\nCountclip(n-gram) is clipped by the maximum number of times an n-gram appears in any corresponding reference sentence.\n\nCountclip(n-gram)=min(matched n-gram count,maxr‚ààR(n-gram count in r))\n\nOnce we‚Äôve computed precision at various n, a final BLEU-N score is computed as the geometric mean of all the precisionn scores.\n\nHowever, since precision relies solely on n-grams and doesn‚Äôt consider the length of the generated output, an output containing just one unigram of a common word (like a stop word) would achieve perfect precision. This can be misleading and encourage outputs that contain fewer words to increase BLEU scores. To counter this, a brevity penalty is added to penalize excessively short sentences.\n\nBP={1if |p|>|r|e1‚àí|r||p|otherwise\n\nThus, the final formula is:\n\nBLEU-N=BP‚ãÖexp‚Å°(‚àën=1NWnlog‚Å°(precisionn))\n\n**[ROUGE](https://aclanthology.org/W04-1013/) (Recall-Oriented Understudy for Gisting Evaluation)**: In contrast to BLEU, ROUGE is recall-oriented. It counts the number of words in the reference that also occur in the output. It‚Äôs typically used to assess automatic summarization tasks.\n\nThere are several ROUGE variants. ROUGE-N is most similar to BLEU in that it also counts the number of matching n-grams between the output and the reference.\n\nROUGE-N=‚àësr‚ààreferences‚àën-gram‚ààsrCountmatch(n-gram)‚àësr‚ààreferences‚àën-gram‚ààsrCount(n-gram)\n\nOther variants include:\n\n  * ROUGE-L: This measures the longest common subsequence (LCS) between the output and the reference. It considers sentence-level structure similarity and zeros in on the longest series of co-occurring in-sequence n-grams.\n  * ROUGE-S: This measures the skip-bigram between the output and reference. Skip-bigrams are pairs of words that maintain their sentence order regardless of the words that might be sandwiched between them.\n\n\n\n**[BERTScore](https://arxiv.org/abs/1904.09675)** is an embedding-based metric that uses cosine similarity to compare each token or n-gram in the generated output with the reference sentence. There are three components to BERTScore:\n\n  * Recall: Average cosine similarity between each token in the reference and its closest match in the generated output.\n  * Precision: Average cosine similarity between each token in the generated output and its nearest match in the reference.\n  * F1: Harmonic mean of recall and precision\n\nRecallBERT=1|r|‚àëi‚ààrmaxj‚ààpi‚ÜíTj‚Üí,PrecisionBERT=1|p|‚àëj‚ààpmaxi‚ààri‚ÜíTj‚Üí BERTscore=FBERT=2‚ãÖPBERT‚ãÖRBERTPBERT+RBERT\n\nBERTScore is useful because it can account for synonyms and paraphrasing. Simpler metrics like BLEU and ROUGE can‚Äôt do this due to their reliance on exact matches. BERTScore has been shown to have better correlation for tasks such as image captioning and machine translation.\n\n**[MoverScore](https://arxiv.org/abs/1909.02622)** also uses contextualized embeddings to compute the distance between tokens in the generated output and reference. But unlike BERTScore, which is based on one-to-one matching (or ‚Äúhard alignment‚Äù) of tokens, MoverScore allows for many-to-one matching (or ‚Äúsoft alignment‚Äù).\n\n![BERTScore \\(left\\) vs. MoverScore \\(right\\)](/assets/mover-score.jpg)\n\nBERTScore (left) vs. MoverScore (right; [source](https://arxiv.org/abs/1909.02622))\n\nMoverScore enables the mapping of semantically related words in one sequence to their counterparts in another sequence. It does this by solving a constrained optimization problem that finds the minimum effort to transform one text into another. The idea is to measure the distance that words would have to move to convert one sequence to another.\n\nHowever, there are several pitfalls to using these conventional benchmarks and metrics.\n\nFirst, there‚Äôs **poor correlation between these metrics and human judgments.** BLEU, ROUGE, and others have had [negative correlation with how humans evaluate fluency](https://arxiv.org/abs/2008.12009). They also showed moderate to less correlation with human adequacy scores. In particular, BLEU and ROUGE have [low correlation with tasks that require creativity and diversity](https://arxiv.org/abs/2303.16634).\n\nSecond, these metrics often have **poor adaptability to a wider variety of tasks**. Adopting a metric proposed for one task to another is not always prudent. For example, exact match metrics such as BLEU and ROUGE are a poor fit for tasks like abstractive summarization or dialogue. Since they‚Äôre based on n-gram overlap between output and reference, they don‚Äôt make sense for a dialogue task where a wide variety of responses are possible. An output can have zero n-gram overlap with the reference but yet be a good response.\n\nThird, these metrics have **poor reproducibility**. Even for the same metric, [high variance is reported across different studies](https://arxiv.org/abs/2008.12009), possibly due to variations in human judgment collection or metric parameter settings. Another study of [ROUGE scores](https://aclanthology.org/2023.acl-long.107/) across 2,000 studies found that scores were hard to reproduce, difficult to compare, and often incorrect because evals were often conducted with untested, incorrect ROUGE implementations.\n\n![Dimensions of model evaluations with ROUGE](/assets/rogue-scores.jpg)\n\nDimensions of model evaluations with ROUGE ([source](https://aclanthology.org/2023.acl-long.107/))\n\nAnd even with recent benchmarks such as MMLU, **the same model can get significantly different scores based on the eval implementation**. [Huggingface compared the original MMLU implementation](https://huggingface.co/blog/evaluating-mmlu-leaderboard) with the HELM and EleutherAI implementations and found that the same example could have different prompts across various providers.\n\n![Different prompts for the same question across MMLU implementations](/assets/mmlu-prompt.jpg)\n\nDifferent prompts for the same question across MMLU implementations ([source](https://huggingface.co/blog/evaluating-mmlu-leaderboard))\n\nFurthermore, the evaluation approach differed across all three benchmarks:\n\n  * Original MMLU: Compares predicted probabilities on the answers only (A, B, C, D)\n  * HELM: Uses the next token probabilities from the model and picks the token with the highest probability, even if it‚Äôs _not_ one of the options.\n  * EleutherAI: Computes probability of the full answer sequence (i.e., a letter followed by the answer text) for each answer. Then, pick answer with highest probability.\n\n\n\n![Different eval for the same question across MMLU implementations](/assets/mmlu-eval.jpg)\n\nDifferent eval for the same question across MMLU implementations ([source](https://huggingface.co/blog/evaluating-mmlu-leaderboard))\n\nAs a result, even for the same eval, both absolute scores and model ranking can fluctuate widely depending on eval implementation. This means that model metrics aren‚Äôt truly comparable‚Äîeven for the same eval‚Äîunless the eval‚Äôs implementation is identical down to minute details like prompts and tokenization. Similarly, the author of QLoRA found MMLU overly sensitive and concluded: ‚Äú[do not work with/report or trust MMLU scores](https://twitter.com/Tim_Dettmers/status/1673446047266504704)‚Äù.\n\nBeyond conventional evals such as those mentioned above, **an emerging trend is to use a strong LLM as a reference-free metric** to evaluate generations from other LLMs. This means we may not need human judgments or gold references for evaluation.\n\n**[G-Eval](https://arxiv.org/abs/2303.16634) is a framework that applies LLMs** with Chain-of-Though (CoT) and a form-filling paradigm to **evaluate LLM outputs**. First, they provide a task introduction and evaluation criteria to an LLM and ask it to generate a CoT of evaluation steps. Then, to evaluate coherence in news summarization, they concatenate the prompt, CoT, news article, and summary and ask the LLM to output a score between 1 to 5. Finally, they use the probabilities of the output tokens from the LLM to normalize the score and take their weighted summation as the final result.\n\n![Overview of G-Eval](/assets/geval.jpg)\n\nOverview of G-Eval ([source](https://arxiv.org/abs/2303.16634))\n\nThey found that GPT-4 as an evaluator had a high Spearman correlation with human judgments (0.514), outperforming all previous methods. It also outperformed traditional metrics on aspects such as coherence, consistency, fluency, and relevance. On topical chat, it did better than traditional metrics such as ROUGE-L, BLEU-4, and BERTScore across several criteria such as naturalness, coherence, engagingness, and groundedness.\n\n**The[Vicuna](https://arxiv.org/abs/2306.05685) paper adopted a similar approach.** They start by defining eight categories (writing, roleplay, extraction, reasoning, math, coding, STEM, and humanities/social science) before developing 10 questions for each category. Next, they generated answers from five chatbots: LLaMA, Alpaca, ChatGPT, Bard, and Vicuna. Finally, they asked GPT-4 to rate the quality of the answers based on helpfulness, relevance, accuracy, and detail.\n\nOverall, they found that GPT-4 not only provided consistent scores but could also give detailed explanations for those scores. Under the single answer grading paradigm, GPT-4 had higher agreement with humans (85%) than the humans had amongst themselves (81%). This suggests that GPT-4‚Äôs judgment aligns closely with the human evaluators.\n\n**[QLoRA](https://arxiv.org/abs/2305.14314) also used an LLM to evaluate another LLM‚Äôs output.** They asked GPT-4 to rate the performance of various models against gpt-3.5-turbo on the Vicuna benchmark. Given the responses from gpt-3.5-turbo and another model, GPT-4 was prompted to score both out of 10 and explain its ratings. They also measured performance via direct comparisons between models, simplifying the task to a three-class rating scheme that included ties.\n\nTo validate the automated evaluation, they collected human judgments on the Vicuna benchmark. Using Mechanical Turk, they enlisted two annotators for comparisons to gpt-3.5-turbo, and three annotators for pairwise comparisons. They found that human and GPT-4 ranking of models were largely in agreement, with a Spearman rank correlation of 0.55 at the model level. This provides an additional data point suggesting that LLM-based automated evals could be a cost-effective and reasonable alternative to human evals.\n\n### How to apply evals?[](#how-to-apply-evals)\n\n**Building solid evals should be the starting point** for any LLM-based system or product (as well as conventional machine learning systems).\n\nUnfortunately, classical metrics such as BLEU and ROUGE don‚Äôt make sense for more complex tasks such as abstractive summarization or dialogue. Furthermore, we‚Äôve seen that benchmarks like MMLU (and metrics like ROUGE) are sensitive to how they‚Äôre implemented and measured. And to be candid, unless your LLM system is studying for a school exam, using MMLU as an eval [doesn‚Äôt quite make sense](https://twitter.com/Tim_Dettmers/status/1680782418335367169).\n\nThus, instead of using off-the-shelf benchmarks, we can **start by collecting a set of task-specific evals** (i.e., prompt, context, expected outputs as references). These evals will then guide prompt engineering, model selection, fine-tuning, and so on. And as we update our systems, we can run these evals to quickly measure improvements or regressions. Think of it as Eval Driven Development (EDD).\n\nIn addition to the evaluation dataset, we **also need useful metrics**. They help us distill performance changes into a single number that‚Äôs comparable across eval runs. And if we can simplify the problem, we can choose metrics that are easier to compute and interpret.\n\nThe simplest task is probably classification: If we‚Äôre using an LLM for classification-like tasks (e.g., toxicity detection, document categorization) or extractive QA without dialogue, we can rely on standard classification metrics such as recall, precision, PRAUC, etc. If our task has no correct answer but we have references (e.g., machine translation, extractive summarization), we can rely on reference metrics based on matching (BLEU, ROUGE) or semantic similarity (BERTScore, MoverScore).\n\nHowever, these metrics may not work for more open-ended tasks such as abstractive summarization, dialogue, and others. But collecting human judgments can be slow and expensive. Thus, we may opt to lean on **automated evaluations via a strong LLM**.\n\nRelative to human judgments which are typically noisy (due to differing biases among annotators), LLM judgments tend to be less noisy (as the bias is more systematic) but more biased. Nonetheless, since we‚Äôre aware of these biases, we can mitigate them accordingly:\n\n  * Position bias: LLMs tend to favor the response in the first position. To mitigate this, we can evaluate the same pair of responses twice while swapping their order. If the same response is preferred in both orders, we mark it as a win; else, it‚Äôs a tie.\n  * Verbosity bias: LLMs tend to favor longer, wordier responses over more concise ones, even if the latter is clearer and of higher quality. A possible solution is to ensure that comparison responses are similar in length.\n  * Self-enhancement bias: LLMs have a slight bias towards their own answers. [GPT-4 favors itself with a 10% higher win rate while Claude-v1 favors itself with a 25% higher win rate.](https://arxiv.org/abs/2306.05685) To counter this, don‚Äôt use the same LLM for evaluation tasks.\n\n\n\nAnother tip: Rather than asking an LLM for a direct evaluation (via giving a score), try giving it a reference and asking for a comparison. This helps with reducing noise.\n\nFinally, sometimes the best eval is human eval aka vibe check. (Not to be confused with the poorly named code evaluation benchmark [HumanEval](https://arxiv.org/abs/2107.03374).) As mentioned in the [Latent Space podcast with MosaicML](https://www.latent.space/p/mosaic-mpt-7b#details) (34th minute):\n\n> The vibe-based eval cannot be underrated. ‚Ä¶ One of our evals was just having a bunch of prompts and watching the answers as the models trained and see if they change. Honestly, I don‚Äôt really believe that any of these eval metrics capture what we care about. One of our prompts was ‚Äúsuggest games for a 3-year-old and a 7-year-old to play‚Äù and that was a lot more valuable to see how the answer changed during the course of training. ‚Äî Jonathan Frankle\n\nAlso see this [deep dive into evals](/writing/abstractive/) for abstractive summarization. It covers reference, context, and preference-based metrics, and also discusses hallucination detection.\n\n## Retrieval-Augmented Generation: To add knowledge[](#retrieval-augmented-generation-to-add-knowledge)\n\nRetrieval-Augmented Generation (RAG) fetches relevant data from outside the foundation model and enhances the input with this data, providing richer context to improve output.\n\n### Why RAG?[](#why-rag)\n\nRAG helps reduce hallucination by grounding the model on the retrieved context, thus increasing factuality. In addition, it‚Äôs cheaper to keep retrieval indices up-to-date than to continuously pre-train an LLM. This cost efficiency makes it easier to provide LLMs with access to recent data via RAG. Finally, if we need to update or remove data such as biased or toxic documents, it‚Äôs more straightforward to update the retrieval index (compared to fine-tuning or prompting an LLM not to generate toxic outputs).\n\nIn short, RAG applies mature and simpler ideas from the field of information retrieval to support LLM generation. In a [recent Sequoia survey](https://www.sequoiacap.com/article/llm-stack-perspective/), 88% of respondents believe that retrieval will be a key component of their stack.\n\n### More about RAG[](#more-about-rag)\n\nBefore diving into RAG, it helps to have a basic understanding of text embeddings. (Feel free to skip this section if you‚Äôre familiar with the subject.)\n\nA text embedding is a **compressed, abstract representation of text data** where text of arbitrary length can be represented as a fixed-size vector of numbers. It‚Äôs usually learned from a corpus of text such as Wikipedia. Think of them as a universal encoding for text, where **similar items are close to each other while dissimilar items are farther apart**.\n\nA good embedding is one that does well on a downstream task, such as retrieving similar items. Huggingface‚Äôs [Massive Text Embedding Benchmark (MTEB)](https://huggingface.co/spaces/mteb/leaderboard) scores various models on diverse tasks such as classification, clustering, retrieval, summarization, etc.\n\nQuick note: While we mainly discuss text embeddings here, embeddings can take many modalities. For example, [CLIP](https://arxiv.org/abs/2103.00020) is multimodal and embeds images and text in the same space, allowing us to find images most similar to an input text. We can also [embed products based on user behavior](/writing/search-query-matching/#supervised-techniques-improves-modeling-of-our-desired-event) (e.g., clicks, purchases) or [graph relationships](/writing/search-query-matching/#self-supervised-techniques-no-need-for-labels).\n\n**RAG has its roots in open-domain Q &A.** An early [Meta paper](https://arxiv.org/abs/2005.04611) showed that retrieving relevant documents via TF-IDF and providing them as context to a language model (BERT) improved performance on an open-domain QA task. They converted each task into a cloze statement and queried the language model for the missing token.\n\nFollowing that, **[Dense Passage Retrieval (DPR)](https://arxiv.org/abs/2004.04906)** showed that using dense embeddings (instead of a sparse vector space such as TF-IDF) for document retrieval can outperform strong baselines like Lucene BM25 (65.2% vs. 42.9% for top-5 accuracy.) They also showed that higher retrieval precision translates to higher end-to-end QA accuracy, highlighting the importance of upstream retrieval.\n\nTo learn the DPR embedding, they fine-tuned two independent BERT-based encoders on existing question-answer pairs. The passage encoder (Ep) embeds text passages into vectors while the query encoder (Eq) embeds questions into vectors. The query embedding is then used to retrieve k passages that are most similar to the question.\n\nThey trained the encoders so that the dot-product similarity makes a good ranking function, and optimized the loss function as the negative log-likelihood of the positive passage. The DPR embeddings are optimized for maximum inner product between the question and relevant passage vectors. The goal is to learn a vector space such that pairs of questions and their relevant passages are close together.\n\nFor inference, they embed all passages (via Ep) and index them in FAISS offline. Then, given a question at query time, they compute the question embedding (via Eq), retrieve the top k passages via approximate nearest neighbors, and provide it to the language model (BERT) that outputs the answer to the question.\n\n**[Retrieval Augmented Generation (RAG)](https://arxiv.org/abs/2005.11401)** , from which this pattern gets its name, highlighted the downsides of pre-trained LLMs. These include not being able to expand or revise memory, not providing insights into generated output, and hallucinations.\n\nTo address these downsides, they introduced RAG (aka semi-parametric models). Dense vector retrieval serves as the non-parametric component while a pre-trained LLM acts as the parametric component. They reused the DPR encoders to initialize the retriever and build the document index. For the LLM, they used BART, a 400M parameter seq2seq model.\n\n![Overview of Retrieval Augmented Generation](/assets/rag.jpg)\n\nOverview of Retrieval Augmented Generation ([source](https://arxiv.org/abs/2005.11401))\n\nDuring inference, they concatenate the input with the retrieved document. Then, the LLM generates tokeni based on the original input, the retrieved document, and the previous i‚àí1 tokens. For generation, they proposed two approaches that vary in how the retrieved passages are used to generate output.\n\nIn the first approach, RAG-Sequence, the model uses the same document to generate the complete sequence. Thus, for k retrieved documents, the generator produces an output for each document. Then, the probability of each output sequence is marginalized (sum the probability of each output sequence in k and weigh it by the probability of each document being retrieved). Finally, the output sequence with the highest probability is selected.\n\nOn the other hand, RAG-Token can generate each token based on a _different_ document. Given k retrieved documents, the generator produces a distribution for the next output token for each document before marginalizing (aggregating all the individual token distributions.). The process is then repeated for the next token. This means that, for each token generation, it can retrieve a different set of k relevant documents based on the original input _and_ previously generated tokens. Thus, documents can have different retrieval probabilities and contribute differently to the next generated token.\n\n[**Fusion-in-Decoder (FiD)**](https://arxiv.org/abs/2007.01282) also uses retrieval with generative models for open-domain QA. It supports two methods for retrieval, BM25 (Lucene with default parameters) and DPR. FiD is named for how it performs fusion on the retrieved documents in the decoder only.\n\n![Overview of Fusion-in-Decoder](/assets/fid.jpg)\n\nOverview of Fusion-in-Decoder ([source](https://arxiv.org/abs/2007.01282))\n\nFor each retrieved passage, the title and passage are concatenated with the question. These pairs are processed independently in the encoder. They also add special tokens such as `question:`, `title:`, and `context:` before their corresponding sections. The decoder attends over the concatenation of these retrieved passages.\n\nBecause it processes passages independently in the encoder, it can scale to a large number of passages as it only needs to do self-attention over one context at a time. Thus, compute grows linearly (instead of quadratically) with the number of retrieved passages, making it more scalable than alternatives such as RAG-Token. Then, during decoding, the decoder processes the encoded passages jointly, allowing it to better aggregate context across multiple retrieved passages.\n\n[**Retrieval-Enhanced Transformer (RETRO)**](https://arxiv.org/abs/2112.04426) adopts a similar pattern where it combines a frozen BERT retriever, a differentiable encoder, and chunked cross-attention to generate output. What‚Äôs different is that RETRO does retrieval throughout the entire pre-training stage, and not just during inference. Furthermore, they fetch relevant documents based on chunks of the input. This allows for finer-grained, repeated retrieval during generation instead of only retrieving once per query.\n\nFor each input chunk (Cu), the k retrieved chunks RET(Cu) are fed into an encoder. The output is the encoded neighbors Euj where Euj=Encoder(RET(Cu)j,Hu)‚ààRr√ód0. Here, each chunk encoding is conditioned on Hu (the intermediate activations) and the activations of chunk Cu through cross-attention layers. In short, the encoding of the retrieved chunks depends on the attended activation of the input chunk. Euj is then used to condition the generation of the next chunk.\n\n![Overview of RETRO](/assets/retro.jpg)\n\nOverview of RETRO ([source](https://arxiv.org/abs/2112.04426))\n\nDuring retrieval, RETRO splits the input sequence into chunks of 64 tokens. Then, it finds text similar to the _previous_ chunk to provide context to the _current_ chunk. The retrieval index consists of two contiguous chunks of tokens, N and F. The former is the neighbor chunk (64 tokens) which is used to compute the key while the latter is the continuation chunk (64 tokens) in the original document.\n\nRetrieval is based on approximate k-nearest neighbors via L2 distance (euclidean) on BERT embeddings. (Interesting departure from the usual cosine or dot product similarity.) The retrieval index, built on SCaNN, can query a 2T token database in 10ms.\n\nThey also demonstrated how to RETRO-fit existing baseline models. By freezing the pre-trained weights and only training the chunked cross-attention and neighbor encoder parameters (< 10% of weights for a 7B model), they can enhance transformers with retrieval while only requiring 6M training sequences (3% of pre-training sequences). RETRO-fitted models were able to surpass the performance of baseline models and achieve performance close to that of RETRO trained from scratch.\n\n![Performance from RETRO-fitting a pre-trained model](/assets/retrofit.jpg)\n\nPerformance from RETRO-fitting a pre-trained model ([source](https://arxiv.org/abs/2112.04426))\n\n**[Internet-augmented LMs](https://arxiv.org/abs/2203.05115)** proposes using a humble ‚Äúoff-the-shelf‚Äù search engine to augment LLMs. First, they retrieve a set of relevant documents via Google Search. Since these retrieved documents tend to be long (average length 2,056 words), they chunk them into paragraphs of six sentences each. Finally, they embed the question and paragraphs via TF-IDF and applied cosine similarity to rank the most relevant paragraphs for each query.\n\n![Overview of internet-augmented LLMs](/assets/internet-llm.jpg)\n\nOverview of internet-augmented LLMs ([source](https://arxiv.org/abs/2203.05115))\n\nThe retrieved paragraphs are used to condition the LLM via few-shot prompting. They adopt the conventional k-shot prompting (k=15) from closed-book QA (only providing question-answer pairs) and extend it with an evidence paragraph, such that each context is an evidence, question, and answer triplet.\n\nFor the generator, they used Gopher, a 280B parameter model trained on 300B tokens. For each question, they generated four candidate answers based on each of the 50 retrieved paragraphs. Finally, they select the best answer by estimating the answer probability via several methods including direct inference, RAG, noisy channel inference, and Product-of-Experts (PoE). PoE consistently performed the best.\n\nRAG has also been **applied to non-QA tasks such as code generation**. While **[CodeT5+](https://arxiv.org/abs/2305.07922)** can be used as a standalone generator, when combined with RAG, it significantly outperforms similar models in code generation.\n\nTo assess the impact of RAG on code generation, they evaluate the model in three settings:\n\n  * Retrieval-based: Fetch the top-1 code sample as the prediction\n  * Generative-only: Output code based on the decoder only\n  * Retrieval-augmented: Append top-1 code sample to encoder input before code generation via the decoder.\n\n\n\n![>Overview of RAG for CodeT5+](/assets/codet5.jpg)\n\nOverview of RAG for CodeT5+ ([source](https://arxiv.org/abs/2305.07922))\n\nAs a qualitative example, they showed that retrieved code provides crucial context (e.g., use `urllib3` for an HTTP request) and guides the generative process towards more correct predictions. In contrast, the generative-only approach returns incorrect output that only captures the concepts of ‚Äúdownload‚Äù and ‚Äúcompress‚Äù.\n\n**What if we don‚Äôt have relevance judgments for query-passage pairs?** Without them, we would not be able to train the bi-encoders that embed the queries and documents in the same embedding space where relevance is represented by the inner product. **[Hypothetical document embeddings (HyDE)](https://arxiv.org/abs/2212.10496)** suggests a solution.\n\n![Overview of HyDE](/assets/hyde.jpg)\n\nOverview of HyDE ([source](https://arxiv.org/abs/2212.10496))\n\nGiven a query, HyDE first prompts an LLM, such as InstructGPT, to generate a hypothetical document. Then, an unsupervised encoder, such as Contriver, encodes the document into an embedding vector. Finally, the inner product is computed between the _hypothetical_ document and the corpus, and the most similar _real_ documents are retrieved.\n\nThe expectation is that the encoder‚Äôs dense bottleneck serves as a lossy compressor and the extraneous, non-factual details are excluded via the embedding. This reframes the relevance modeling problem from a representation learning task to a generation task.\n\n### How to apply RAG[](#how-to-apply-rag)\n\nFrom experience with [Obsidian-Copilot](/writing/obsidian-copilot/), I‚Äôve found that hybrid retrieval (traditional search index + embedding-based search) works better than either alone. There, I complemented classical retrieval (BM25 via OpenSearch) with semantic search (`e5-small-v2`).\n\nWhy not embedding-based search only? While it‚Äôs great in many instances, there are situations where it falls short, such as:\n\n  * Searching for a person or object‚Äôs name (e.g., Eugene, Kaptir 2.0)\n  * Searching for an acronym or phrase (e.g., RAG, RLHF)\n  * Searching for an ID (e.g., `gpt-3.5-turbo`, `titan-xlarge-v1.01`)\n\n\n\nBut keyword search has its limitations too. It only models simple word frequencies and doesn‚Äôt capture semantic or correlation information. Thus, it doesn‚Äôt deal well with synonyms or hypernyms (i.e., words that represent a generalization). This is where combining it with semantic search is complementary.\n\nIn addition, with a conventional search index, we can use metadata to refine results. For example, we can use date filters to prioritize newer documents or narrow our search to a specific time period. And if the search is related to e-commerce, filters on average rating or categories are helpful. Finally, having metadata is handy for downstream ranking, such as prioritizing documents that are cited more, or boosting products by their sales volume.\n\n**With regard to embeddings** , the seemingly popular approach is to use [`text-embedding-ada-002`](https://openai.com/blog/new-and-improved-embedding-model). Its benefits include ease of use via an API and not having to maintain our own embedding infra or self-host embedding models. Nonetheless, personal experience and anecdotes from others suggest there are better alternatives for retrieval.\n\nThe OG embedding approaches include Word2vec and [fastText](https://fasttext.cc). FastText is an open-source, lightweight library that enables users to leverage pre-trained embeddings or train new embedding models. It comes with pre-trained embeddings for 157 languages and is extremely fast, even without a GPU. It‚Äôs my go-to for early-stage proof of concepts.\n\nAnother good baseline is [sentence-transformers](https://github.com/UKPLab/sentence-transformers). It makes it simple to compute embeddings for sentences, paragraphs, and even images. It‚Äôs based on workhorse transformers such as BERT and RoBERTa and is available in more than 100 languages.\n\nMore recently, instructor models have shown SOTA performance. During training, these models prepend the task description to the text. Then, when embedding new text, we simply have to describe the task to get task-specific embeddings. (Not that different from instruction tuning for embedding models IMHO.)\n\nAn example is the [E5](https://arxiv.org/abs/2212.03533) family of models. For open QA and information retrieval, we simply prepend documents in the index with `passage:`, and prepend queries with `query:`. If the task is symmetric (e.g., semantic similarity, paraphrase retrieval) or if we want to use embeddings as features (e.g., classification, clustering), we just use the `query:` prefix.\n\nThe [Instructor](https://arxiv.org/abs/2212.09741) model takes it a step further, allowing users to customize the prepended prompt: ‚ÄúRepresent the `domain` `task_type` for the `task_objective`:‚Äù For example, ‚ÄúRepresent the Wikipedia document for retrieval:‚Äù. (The domain and task objective are optional). This brings the concept of prompt tuning into the field of text embedding.\n\nFinally, as of Aug 1st, the top embedding model on the [MTEB Leaderboard](https://huggingface.co/spaces/mteb/leaderboard) is the [GTE](https://huggingface.co/thenlper/gte-large) family of models by Alibaba DAMO Academy. The top performing model‚Äôs size is half of the next best model `e5-large-v2` (0.67GB vs 1.34GB). In 2nd position is `gte-base` with a model size of only 0.22GB and embedding dimension of 768. (H/T [Nirant](https://twitter.com/NirantK).)\n\nTo retrieve documents with low latency at scale, we use approximate nearest neighbors (ANN). It optimizes for retrieval speed and returns the approximate (instead of exact) top k most similar neighbors, trading off a little accuracy loss for a large speed up.\n\nANN embedding indices are data structures that let us do ANN searches efficiently. At a high level, they build partitions over the embedding space so we can quickly zoom in on the specific space where the query vector is. Some popular techniques include:\n\n  * [Locality Sensitive Hashing](https://en.wikipedia.org/wiki/Locality-sensitive_hashing) (LSH): The core idea is to create hash functions so that similar items are likely to end up in the same hash bucket. By only needing to check the relevant buckets, we can perform ANN queries efficiently.\n  * [Facebook AI Similarity Search](https://github.com/facebookresearch/faiss) (FAISS): It uses a combination of quantization and indexing for efficient retrieval, supports both CPU and GPU, and can handle billions of vectors due to its efficient use of memory.\n  * [Hierarchical Navigable Small Worlds](https://github.com/nmslib/hnswlib) (HNSW): Inspired by ‚Äúsix degrees of separation‚Äù, it builds a hierarchical graph structure that embodies the small world phenomenon. Here, most nodes can be reached from any other node via a minimum number of hops. This structure allows HNSW to initiate queries from broader, coarser approximations and progressively narrow the search at lower levels.\n  * [Scalable Nearest Neighbors](https://github.com/google-research/google-research/tree/master/scann) (ScaNN): It has a two-step process. First, coarse quantization reduces the search space. Then, fine-grained search is done within the reduced set. Best recall/latency trade-off I‚Äôve seen.\n\n\n\nWhen evaluating an ANN index, some factors to consider include:\n\n  * Recall: How does it fare against exact nearest neighbors?\n  * Latency/throughput: How many queries can it handle per second?\n  * Memory footprint: How much RAM is required to serve an index?\n  * Ease of adding new items: Can new items be added without having to reindex all documents (LSH) or does the index need to be rebuilt (ScaNN)?\n\n\n\nNo single framework is better than all others in every aspect. Thus, start by defining your functional and non-functional requirements before benchmarking. Personally, I‚Äôve found ScaNN to be outstanding in the recall-latency trade-off (see benchmark graph [here](/writing/real-time-recommendations/#how-to-design-and-implement-an-mvp)).\n\n## Fine-tuning: To get better at specific tasks[](#fine-tuning-to-get-better-at-specific-tasks)\n\nFine-tuning is the process of taking a pre-trained model (that has already been trained with a vast amount of data) and further refining it on a specific task. The intent is to harness the knowledge that the model has already acquired during its pre-training and apply it to a specific task, usually involving a smaller, task-specific, dataset.\n\nThe term ‚Äúfine-tuning‚Äù is used loosely and can refer to several concepts such as:\n\n  * **Continued pre-training** : With domain-specific data, apply the same pre-training regime (next token prediction, masked language modeling) on the base model.\n  * **Instruction fine-tuning** : The pre-trained (base) model is fine-tuned on examples of instruction-output pairs to follow instructions, answer questions, be waifu, etc.\n  * **Single-task fine-tuning** : The pre-trained model is honed for a narrow and specific task such as toxicity detection or summarization, similar to BERT and T5.\n  * **Reinforcement learning with human feedback (RLHF)** : This combines instruction fine-tuning with reinforcement learning. It requires collecting human preferences (e.g., pairwise comparisons) which are then used to train a reward model. The reward model is then used to further fine-tune the instructed LLM via RL techniques such as proximal policy optimization (PPO).\n\n\n\nWe‚Äôll mainly focus on single-task and instruction fine-tuning here.\n\n### Why fine-tuning?[](#why-fine-tuning)\n\nFine-tuning an open LLM is becoming an increasingly viable alternative to using a 3rd-party, cloud-based LLM for several reasons.\n\n**Performance & control:** Fine-tuning can improve the performance of an off-the-shelf base model, and may even surpass a 3rd-party LLM. It also provides greater control over LLM behavior, resulting in a more robust system or product. Overall, fine-tuning enables us to build products that are differentiated from simply using 3rd-party or open LLMs.\n\n**Modularization:** Single-task fine-tuning lets us to use an army of smaller models that each specialize on their own tasks. Via this setup, a system can be modularized into individual models for tasks like content moderation, extraction, summarization, etc. Also, given that each model only has to focus on a narrow set of tasks, we can get around the alignment tax, where fine-tuning a model on one task reduces performance on other tasks.\n\n**Reduced dependencies:** By fine-tuning and hosting our own models, we can reduce legal concerns about proprietary data (e.g., PII, internal documents and code) being exposed to external APIs. It also gets around constraints that come with 3rd-party LLMs such as rate-limiting, high costs, or overly restrictive safety filters. By fine-tuning and hosting our own LLMs, we can ensure data doesn‚Äôt leave our network, and can scale throughput as needed.\n\n### More about fine-tuning[](#more-about-fine-tuning)\n\nWhy do we need to fine-tune a _base_ model? At the risk of oversimplifying, base models are primarily optimized to predict the next word based on the corpus they‚Äôre trained on. Hence, they aren‚Äôt naturally adept at following instructions or answering questions. When posed a question, they tend to respond with more questions. Thus, we perform instruction fine-tuning so they learn to respond appropriately.\n\nHowever, fine-tuning isn‚Äôt without its challenges. First, we **need a significant volume of demonstration data**. For instance, in the [InstructGPT paper](https://arxiv.org/abs/2203.02155), they used 13k instruction-output samples for supervised fine-tuning, 33k output comparisons for reward modeling, and 31k prompts without human labels as input for RLHF.\n\nFurthermore, fine-tuning comes with an alignment tax‚Äîthe process can lead to **lower performance on certain critical tasks**. (There‚Äôs no free lunch after all.) The same InstructGPT paper found that RLHF led to performance regressions (relative to the GPT-3 base model) on public NLP tasks like SQuAD, HellaSwag, and WMT 2015 French to English. (A workaround is to have several smaller, specialized models that excel at narrow tasks.)\n\nFine-tuning is similar to the concept of transfer learning. As defined in Wikipedia: ‚ÄúTransfer learning is a technique in machine learning in which knowledge learned from a task is re-used to boost performance on a related task.‚Äù Several years ago, transfer learning made it easy for me to apply ResNet models trained on ImageNet to [classify fashion products](/writing/image-categorization-is-now-live/) and [build image search](/writing/image-search-is-now-live/).\n\n**[ULMFit](https://arxiv.org/abs/1801.06146)** is one of the earlier papers to apply transfer learning to text. They established the protocol of self-supervised pre-training (on unlabeled data) followed by fine-tuning (on labeled data). They used AWS-LSTM, an LSTM variant with dropout at various gates.\n\n![Overview of ULMFit](/assets/ulmfit.jpg)\n\nOverview of ULMFit ([source](https://arxiv.org/abs/1801.06146))\n\nDuring pre-training (next word prediction), the model is trained on wikitext-103 which contains 28.6 Wikipedia articles and 103M words. Then, during target task fine-tuning, the LM is fine-tuned with data from the domain of the specific task. Finally, during classifier fine-tuning, the model is augmented with two additional linear blocks and fine-tuned on the target classification tasks which includes sentiment analysis, question classification, and topic classification.\n\nSince then, the pre-training followed by fine-tuning paradigm has driven much progress in language modeling. **[Bidirectional Encoder Representations from Transformers (BERT; encoder only)](https://arxiv.org/abs/1810.04805)** was pre-trained on masked language modeling and next sentence prediction on English Wikipedia and BooksCorpus. It was then fine-tuned on task-specific inputs and labels for single-sentence classification, sentence pair classification, single-sentence tagging, and question & answering.\n\n![Overview of BERT](/assets/bert.jpg)\n\nOverview of BERT ([source](https://arxiv.org/abs/1810.04805))\n\n**[Generative Pre-trained Transformers (GPT; decoder only)](https://s3-us-west-2.amazonaws.com/openai-assets/research-covers/language-unsupervised/language_understanding_paper.pdf)** was first pre-trained on BooksCorpus via next token prediction. This was followed by single-task fine-tuning for tasks such as text classification, textual entailment, similarity, and Q&A. Interestingly, they found that including language modeling as an auxiliary objective helped the model generalize and converge faster during training.\n\n![Overview of GPT](/assets/gpt.jpg)\n\nOverview of GPT ([source](https://s3-us-west-2.amazonaws.com/openai-assets/research-covers/language-unsupervised/language_understanding_paper.pd))\n\n**[Text-to-text Transfer Transformer (T5; encoder-decoder)](https://arxiv.org/abs/1910.10683)** was pre-trained on the Colossal Clean Crawled Corpus (C4), a cleaned version of the Common Crawl from April 2019. It employed the same denoising objective as BERT, namely masked language modeling. It was then fine-tuned on tasks such as text classification, abstractive summarization, Q&A, and machine translation.\n\n![Overview of T5](/assets/t5.jpg)\n\nOverview of T5 ([source](https://arxiv.org/abs/1910.10683))\n\nBut unlike ULMFIt, BERT, and GPT which used different classifier heads for downstream tasks, T5 represented downstream tasks as text-to-text only. For example, a translation task would have input text starting with `Translation English to German:`, while a summarization task might start with `Summarize:` or `TL;DR:`. The prefix essentially became a hyperparameter (first instance of prompt engineering?) This design choice allowed them to use a single fine-tuned model across a variety of downstream tasks.\n\n**[InstructGPT](https://arxiv.org/abs/2203.02155)** expanded this idea of single-task fine-tuning to instruction fine-tuning. The base model was GPT-3, pre-trained on internet data including Common Crawl, WebText, Books, and Wikipedia. It then applied supervised fine-tuning on demonstrations of desired behavior (instruction and output). Next, it trained a reward model on the dataset of comparisons. Finally, it optimized the instructed model against the reward model via PPO, with this last stage focusing more on alignment than specific task performance.\n\n![Overview of fine-tuning steps in InstructGPT](/assets/instructgpt.jpg)\n\nOverview of fine-tuning steps in InstructGPT ([source](https://arxiv.org/abs/2203.02155))\n\nNext, let‚Äôs move from fine-tuned models to fine-tuning techniques.\n\n**[Soft prompt tuning](https://arxiv.org/abs/2104.08691)** prepends a trainable tensor to the model‚Äôs input embeddings, essentially creating a soft prompt. Unlike discrete text prompts, soft prompts can be learned via backpropagation, meaning they can be fine-tuned to incorporate signals from any number of labeled examples.\n\nNext, there‚Äôs **[prefix tuning](https://arxiv.org/abs/2101.00190)**. Instead of adding a soft prompt to the model input, it prepends trainable parameters to the hidden states of all transformer blocks. During fine-tuning, the LM‚Äôs original parameters are kept frozen while the prefix parameters are updated.\n\n![Overview of prefix-tuning](/assets/prefix.jpg)\n\nOverview of prefix-tuning ([source](https://arxiv.org/abs/2101.00190))\n\nThe paper showed that this achieved performance comparable to full fine-tuning despite requiring updates on just 0.1% of parameters. Moreover, in settings with limited data and involved extrapolation to new topics, it outperformed full fine-tuning. One hypothesis is that training fewer parameters helped reduce overfitting on smaller target datasets.\n\nThere‚Äôs also the **[adapter](https://arxiv.org/abs/1902.00751)** technique. This method adds fully connected network layers twice to each transformer block, after the attention layer and after the feed-forward network layer. On GLUE, it‚Äôs able to achieve within 0.4% of the performance of full fine-tuning by just adding 3.6% parameters per task.\n\n![Overview of adapters](/assets/adapter.jpg)\n\nOverview of adapters ([source](https://arxiv.org/abs/1902.00751))\n\n**[Low-Rank Adaptation (LoRA)](https://arxiv.org/abs/2106.09685)** is a technique where adapters are designed to be the product of two low-rank matrices. It was inspired by [Aghajanyan et al.](https://arxiv.org/abs/2012.13255) which showed that, when adapting to a specific task, pre-trained language models have a low intrinsic dimension and can still learn efficiently despite a random projection into a smaller subspace. Thus, LoRA hypothesized that weight updates during adaption also have low intrinsic rank.\n\n![Overview of LoRA](/assets/lora.jpg)\n\nOverview of LoRA ([source](https://arxiv.org/abs/2106.09685))\n\nSimilar to prefix tuning, they found that LoRA outperformed several baselines including full fine-tuning. Again, the hypothesis is that LoRA, thanks to its reduced rank, provides implicit regularization. In contrast, full fine-tuning, which updates all weights, could be prone to overfitting.\n\n**[QLoRA](https://arxiv.org/abs/2305.14314)** builds on the idea of LoRA. But instead of using the full 16-bit model during fine-tuning, it applies a 4-bit quantized model. It introduced several innovations such as 4-bit NormalFloat (to quantize models), double quantization (for additional memory savings), and paged optimizers (that prevent OOM errors by transferring data to CPU RAM when the GPU runs out of memory).\n\n![Overview of QLoRA](/assets/qlora.jpg)\n\nOverview of QLoRA ([source](https://arxiv.org/abs/2305.14314))\n\nAs a result, QLoRA reduces the average memory requirements for fine-tuning a 65B model from > 780GB memory to a more manageable 48B without degrading runtime or predictive performance compared to a 16-bit fully fine-tuned baseline.\n\n(Fun fact: During a meetup with Tim Dettmers, an author of QLoRA, he quipped that double quantization was ‚Äúa bit of a silly idea but works perfectly.‚Äù Hey, if it works, it works.)\n\n### How to apply fine-tuning?[](#how-to-apply-fine-tuning)\n\nThe first step is to **collect demonstration data/labels**. These could be for straightforward tasks such as document classification, entity extraction, or summarization, or they could be more complex such as Q&A or dialogue. Some ways to collect this data include:\n\n  * **Via experts or crowd-sourced human annotators** : While this is expensive and slow, it usually leads to higher-quality data with [good guidelines](/writing/labeling-guidelines/).\n  * **Via user feedback** : This can be as simple as asking users to select attributes that describe a product, rating LLM responses with thumbs up or down (e.g., ChatGPT), or logging which images users choose to download (e.g., Midjourney).\n  * **Query larger open models with permissive licenses** : With prompt engineering, we might be able to elicit reasonable demonstration data from a larger model (Falcon 40B Instruct) that can be used to fine-tune a smaller model.\n  * **Reuse open-source data** : If your task can be framed as a natural language inference (NLI) task, we could fine-tune a model to perform NLI using [MNLI data](https://cims.nyu.edu/~sbowman/multinli/). Then, we can continue fine-tuning the model on internal data to classify inputs as entailment, neutral, or contradiction.\n\n\n\nNote: Some LLM terms prevent users from using their output to develop other models.\n\n  * [OpenAI Terms of Use](https://openai.com/policies/terms-of-use) (Section 2c, iii): You may not use output from the Services to develop models that compete with OpenAI.\n  * [LLaMA 2 Community License Agreement](https://ai.meta.com/llama/license/) (Section 1b-v): You will not use the Llama Materials or any output or results of the Llama Materials to improve any other large language model (excluding Llama 2 or derivative works thereof).\n\n\n\nThe next step is to **define evaluation metrics**. We‚Äôve discussed this in a [previous section](#evals-to-measure-performance-scalably).\n\nThen, **select a pre-trained model.** There are [several open LLMs with permissive licenses](https://github.com/eugeneyan/open-llms) to choose from. Excluding Llama 2 (since it isn‚Äôt fully commercial use), Falcon-40B is known to be the best-performing model. Nonetheless, I‚Äôve found it unwieldy to fine-tune and serve in production given how heavy it is.\n\nInstead, I‚Äôm inclined to use smaller models like the Falcon-7B. And if we can simplify and frame the task more narrowly, BERT (340M params), RoBERTA (355M params), and BART (406M params) are solid picks for classification and natural language inference tasks. Beyond that, Flan-T5 (770M and 3B variants) is a reliable baseline for translation, abstractive summarization, headline generation, etc.\n\nWe may also need to **update the model architecture** , such as when the pre-trained model‚Äôs architecture doesn‚Äôt align with the task. For example, we might need to update the classification heads on BERT or T5 to match our task. Tip: If the task is a simple binary classification task, NLI models can work out of the box. Entailment is mapped to positive, contradiction is mapped to negative, while the neural label can indicate uncertainty.\n\n**Then, pick a fine-tuning approach.** LoRA and QLoRA are good places to start. But if your fine-tuning is more intensive, such as continued pre-training on new domain knowledge, you may find full fine-tuning necessary.\n\n**Finally, basic hyperparameter tuning.** Generally, most papers focus on learning rate, batch size, and number of epochs (see LoRA, QLoRA). And if we‚Äôre using LoRA, we might want to tune the rank parameter (though the QLoRA paper found that different rank and alpha led to similar results). Other hyperparameters include input sequence length, loss type (contrastive loss vs. token match), and data ratios (like the mix of pre-training or demonstration data, or the ratio of positive to negative examples, among others).\n\n## Caching: To reduce latency and cost[](#caching-to-reduce-latency-and-cost)\n\nCaching is a technique to store data that has been previously retrieved or computed. This way, future requests for the same data can be served faster. In the space of serving LLM generations, the popularized approach is to cache the LLM response keyed on the embedding of the input request. Then, for each new request, if a semantically similar request is received, we can serve the cached response.\n\nFor some practitioners, this sounds like ‚Äú[a disaster waiting to happen.](https://twitter.com/HanchungLee/status/1681146845186363392)‚Äù I‚Äôm inclined to agree. Thus, I think the key to adopting this pattern is figuring out how to cache safely, instead of solely depending on semantic similarity.\n\n### Why caching?[](#why-caching)\n\nCaching can significantly reduce latency for responses that have been served before. In addition, by eliminating the need to compute a response for the same input again and again, we can reduce the number of LLM requests and thus save cost. Also, there are certain use cases that do not support latency on the order of seconds. Thus, pre-computing and caching may be the only way to serve those use cases.\n\n### More about caching[](#more-about-caching)\n\nA cache is a high-speed storage layer that stores a subset of data that‚Äôs accessed more frequently. This lets us serve these requests faster via the cache instead of the data‚Äôs primary storage (e.g., search index, relational database). Overall, caching enables efficient reuse of previously fetched or computed data. (More about [caching](https://aws.amazon.com/caching/) and [best practices](https://aws.amazon.com/caching/best-practices/).)\n\nAn example of caching for LLMs is [GPTCache](https://github.com/zilliztech/GPTCache).\n\n![Overview of GPTCache](/assets/gptcache.jpg)\n\nOverview of GPTCache ([source](https://github.com/zilliztech/GPTCache))\n\nWhen a new request is received:\n\n  * Embedding generator: This embeds the request via various models such as OpenAI‚Äôs `text-embedding-ada-002`, FastText, Sentence Transformers, and more.\n  * Similarity evaluator: This computes the similarity of the request via the vector store and then provides a distance metric. The vector store can either be local (FAISS, Hnswlib) or cloud-based. It can also compute similarity via a model.\n  * Cache storage: If the request is similar, the cached response is fetched and served.\n  * LLM: If the request isn‚Äôt similar enough, it gets passed to the LLM which then generates the result. Finally, the response is served and cached for future use.\n\n\n\nRedis also shared a [similar example](https://www.youtube.com/live/9VgpXcfJYvw?feature=share&t=1517), mentioning that some teams go as far as precomputing all the queries they anticipate receiving. Then, they set a similarity threshold on which queries are similar enough to warrant a cached response.\n\n### How to apply caching?[](#how-to-apply-caching)\n\n**We should start with having a good understanding of user request patterns**. This allows us to design the cache thoughtfully so it can be applied reliably.\n\nFirst, let‚Äôs consider a non-LLM example. Imagine we‚Äôre caching product prices for an e-commerce site. During checkout, is it safe to display the (possibly outdated) cached price? Probably not, since the price the customer sees during checkout should be the same as the final amount they‚Äôre charged. Caching isn‚Äôt appropriate here as we need to ensure consistency for the customer.\n\nNow, bringing it back to LLM responses. Imagine we get a request for a summary of ‚ÄúMission Impossible 2‚Äù that‚Äôs semantically similar enough to ‚ÄúMission Impossible 3‚Äù. If we‚Äôre looking up cache based on semantic similarity, we could serve the wrong response.\n\nWe also need to **consider if caching is effective for the usage pattern.** One way to quantify this is via the cache hit rate (percentage of requests served directly from the cache). If the usage pattern is uniformly random, the cache would need frequent updates. Thus, the effort to keep the cache up-to-date could negate any benefit a cache has to offer. On the other hand, if the usage follows a power law where a small proportion of unique requests account for the majority of traffic (e.g., search queries, product views), then caching could be an effective strategy.\n\nBeyond semantic similarity, we could also explore caching based on:\n\n  * **Item IDs:** This applies when we pre-compute [summaries of product reviews](https://www.cnbc.com/2023/06/12/amazon-is-using-generative-ai-to-summarize-product-reviews.html) or generate a summary for an entire movie trilogy.\n  * **Pairs of Item IDs:** Such as when we generate comparisons between two movies. While this appears to be O(N2), in practice, a small number of combinations drive the bulk of traffic, such as comparison between popular movies in a series or genre.\n  * **Constrained input:** Such as variables like movie genre, director, or lead actor. For example, if a user is looking for movies by a specific director, we could execute a structured query and run it through an LLM to frame the response more eloquently. Another example is [generating code based on drop-down options](https://cheatlayer.com)‚Äîif the code has been verified to work, we can cache it for reliable reuse.\n\n\n\nAlso, **caching doesn‚Äôt only have to occur on-the-fly.** As Redis shared, we can pre-compute LLM generations offline or asynchronously before serving them. By serving from a cache, we shift the latency from generation (typically seconds) to cache lookup (milliseconds). Pre-computing in batch can also help reduce cost relative to serving in real-time.\n\nWhile the approaches listed here may not be as flexible as semantically caching on natural language inputs, I think it provides a good balance between efficiency and reliability.\n\n## Guardrails: To ensure output quality[](#guardrails-to-ensure-output-quality)\n\nIn the context of LLMs, guardrails validate the output of LLMs, ensuring that the output doesn‚Äôt just sound good but is also syntactically correct, factual, and free from harmful content. It also includes guarding against adversarial input.\n\n### Why guardrails?[](#why-guardrails)\n\nFirst, they help ensure that model outputs are reliable and consistent enough to use in production. For example, we may require output to be in a specific JSON schema so that it‚Äôs machine-readable, or we need code generated to be executable. Guardrails can help with such syntactic validation.\n\nSecond, they provide an additional layer of safety and maintain quality control over an LLM‚Äôs output. For example, to verify if the content generated is appropriate for serving, we may want to check that the output isn‚Äôt harmful, verify it for factual accuracy, or ensure coherence with the context provided.\n\n### More about guardrails[](#more-about-guardrails)\n\n**One approach is to control the model‚Äôs responses via prompts.** For example, Anthropic shared about prompts designed to guide the model toward generating responses that are [helpful, harmless, and honest](https://arxiv.org/abs/2204.05862) (HHH). They found that Python fine-tuning with the HHH prompt led to better performance compared to fine-tuning with RLHF.\n\n![Example of HHH prompt](/assets/hhh.jpg)\n\nExample of HHH prompt ([source](https://arxiv.org/abs/2204.05862))\n\n**A more common approach is to validate the output.** An example is the [Guardrails package](https://github.com/ShreyaR/guardrails). It allows users to add structural, type, and quality requirements on LLM outputs via Pydantic-style validation. And if the check fails, it can trigger corrective action such as filtering on the offending output or regenerating another response.\n\nMost of the validation logic is in [`validators.py`](https://github.com/ShreyaR/guardrails/blob/main/guardrails/validators.py). It‚Äôs interesting to see how they‚Äôre implemented. Broadly speaking, its validators fall into the following categories:\n\n  * Single output value validation: This includes ensuring that the output (i) is one of the predefined choices, (ii) has a length within a certain range, (iii) if numeric, falls within an expected range, and (iv) is a complete sentence.\n  * Syntactic checks: This includes ensuring that generated URLs are valid and reachable, and that Python and SQL code is bug-free.\n  * Semantic checks: This verifies that the output is aligned with the reference document, or that the extractive summary closely matches the source document. These checks can be done via cosine similarity or fuzzy matching techniques.\n  * Safety checks: This ensures that the generated output is free of inappropriate language or that the quality of translated text is high.\n\n\n\nNvidia‚Äôs [NeMo-Guardrails](https://github.com/NVIDIA/NeMo-Guardrails) follows a similar principle but is designed to guide LLM-based conversational systems. Rather than focusing on syntactic guardrails, it emphasizes semantic ones. This includes ensuring that the assistant steers clear of politically charged topics, provides factually correct information, and can detect jailbreaking attempts.\n\nThus, NeMo‚Äôs approach is somewhat different: Instead of using more deterministic checks like verifying if a value exists in a list or inspecting code for syntax errors, NeMo leans heavily on using another LLM to validate outputs (inspired by [SelfCheckGPT](https://arxiv.org/abs/2303.08896)).\n\nIn their example for fact-checking and preventing hallucination, they ask the LLM itself to check whether the most recent output is consistent with the given context. To fact-check, the LLM is queried if the response is true based on the documents retrieved from the knowledge base. To prevent hallucinations, since there isn‚Äôt a knowledge base available, they get the LLM to generate multiple alternative completions which serve as the context. The underlying assumption is that if the LLM produces multiple completions that disagree with one another, the original completion is likely a hallucination.\n\nThe moderation example follows a similar approach: The response is screened for harmful and unethical content via an LLM. Given the nuance of ethics and harmful content, heuristics and conventional machine learning techniques fall short. Thus, an LLM is required for a deeper understanding of the intent and structure of dialogue.\n\nApart from using guardrails to verify the output of LLMs, we can also **directly steer the output to adhere to a specific grammar.** An example of this is Microsoft‚Äôs [Guidance](https://github.com/microsoft/guidance). Unlike Guardrails which [imposes JSON schema via a prompt](https://github.com/ShreyaR/guardrails/blob/main/guardrails/constants.xml#L14), Guidance enforces the schema by injecting tokens that make up the structure.\n\nWe can think of Guidance as a domain-specific language for LLM interactions and output. It draws inspiration from [Handlebars](https://handlebarsjs.com), a popular templating language used in web applications that empowers users to perform variable interpolation and logical control.\n\nHowever, Guidance sets itself apart from regular templating languages by executing linearly. This means it maintains the order of tokens generated. Thus, by inserting tokens that are part of the structure‚Äîinstead of relying on the LLM to generate them correctly‚ÄîGuidance can dictate the specific output format. In their examples, they show how to [generate JSON that‚Äôs always valid](https://github.com/microsoft/guidance#guaranteeing-valid-syntax-json-example-notebook), [generate complex output formats](https://github.com/microsoft/guidance#rich-output-structure-example-notebook) with multiple keys, ensure that LLMs [play the right roles](https://github.com/microsoft/guidance#role-based-chat-model-example-notebook), and have [agents interact with each other](https://github.com/microsoft/guidance#agents-notebook).\n\nThey also introduced a concept called [token healing](https://github.com/microsoft/guidance#token-healing-notebook), a useful feature that helps avoid subtle bugs that occur due to tokenization. In simple terms, it rewinds the generation by one token before the end of the prompt and then restricts the first generated token to have a prefix matching the last token in the prompt. This eliminates the need to fret about token boundaries when crafting prompts.\n\n### How to apply guardrails?[](#how-to-apply-guardrails)\n\nThough the concept of guardrails for LLMs in industry is still nascent, there are a handful of immediately useful and practical strategies we can consider.\n\n**Structural guidance:** Apply guidance whenever possible. It provides direct control over outputs and offers a more precise method to ensure that output conforms to a specific structure or format.\n\n**Syntactic guardrails:** These include checking if categorical output is within a set of acceptable choices, or if numeric output is within an expected range. Also, if we generate SQL, these can verify its free from syntax errors and also ensure that all columns in the query match the schema. Ditto for generating code (e.g., Python, JavaScript).\n\n**Content safety guardrails:** These verify that the output has no harmful or inappropriate content. It can be as simple as checking against the [List of Dirty, Naughty, Obscene, and Otherwise Bad Words](https://github.com/LDNOOBW/List-of-Dirty-Naughty-Obscene-and-Otherwise-Bad-Words) or using [profanity detection](https://pypi.org/project/profanity-check/) models. (It‚Äôs [common to run moderation classifiers on output](https://twitter.com/goodside/status/1685023251532320768).) More complex and nuanced output can rely on an LLM evaluator.\n\n**Semantic/factuality guardrails:** These confirm that the output is semantically relevant to the input. Say we‚Äôre generating a two-sentence summary of a movie based on its synopsis. We can validate if the produced summary is semantically similar to the output, or have (another) LLM ascertain if the summary accurately represents the provided synopsis.\n\n**Input guardrails:** These limit the types of input the model will respond to, helping to mitigate the risk of the model responding to inappropriate or adversarial prompts which would lead to generating harmful content. For example, you‚Äôll get an error if you ask Midjourney to generate NSFW content. This can be as straightforward as comparing against a list of strings or using a moderation classifier.\n\n![An example of an input guardrail on Midjourney](/assets/input-guardrail.jpg)\n\nAn example of an input guardrail on Midjourney\n\n## Defensive UX: To anticipate & handle errors gracefully[](#defensive-ux-to-anticipate--handle-errors-gracefully)\n\nDefensive UX is a design strategy that acknowledges that bad things, such as inaccuracies or hallucinations, can happen during user interactions with machine learning or LLM-based products. Thus, the intent is to anticipate and manage these in advance, primarily by guiding user behavior, averting misuse, and handling errors gracefully.\n\n### Why defensive UX?[](#why-defensive-ux)\n\nMachine learning and LLMs aren‚Äôt perfect‚Äîthey can produce inaccurate output. Also, they respond differently to the same input over time, such as search engines displaying varying results due to personalization, or LLMs generating diverse output on more creative, higher temperature, settings. This can violate the principle of consistency which advocates for a consistent UI and predictable behaviors.\n\nDefensive UX can help mitigate the above by providing:\n\n  * **Increased accessibility** : By helping users understand how ML/LLM features work and their limitations, defensive UX makes it more accessible and user-friendly.\n  * **Increased trust** : When users see that the feature can handle difficult scenarios gracefully and doesn‚Äôt produce harmful output, they‚Äôre likely to trust it more.\n  * **Better UX** : By designing the system and UX to handle ambiguous situations and errors, defensive UX paves the way for a smoother, more enjoyable user experience.\n\n\n\n### More about defensive UX[](#more-about-defensive-ux)\n\nTo learn more about defensive UX, we can look at Human-AI guidelines from Microsoft, Google, and Apple.\n\n**Microsoft‚Äôs[Guidelines for Human-AI Interaction](https://www.microsoft.com/en-us/research/publication/guidelines-for-human-ai-interaction/)** is based on a survey of 168 potential guidelines. These were collected from internal and external industry sources, academic literature, and public articles. After combining guidelines that were similar, filtering guidelines that were too vague or too specific or not AI-specific, and a round of heuristic evaluation, they narrowed it down to 18 guidelines.\n\n![Guidelines for Human-AI interaction across the user journey](/assets/ms-guidelines.jpg)\n\nGuidelines for Human-AI interaction across the user journey ([source](https://www.microsoft.com/en-us/research/project/guidelines-for-human-ai-interaction/))\n\nThese guidelines follow a certain style: Each one is a succinct action rule of 3 - 10 words, beginning with a verb. Each rule is accompanied by a one-liner that addresses potential ambiguities. They are organized based on their likely application during user interaction:\n\n  * Initially: Make clear what the system can do (G1), make clear how well the system can do what it can do (G2)\n  * During interaction: Time services based on context (G3), mitigate social biases (G6)\n  * When wrong: Support efficient dismissal (G8), support efficient correction (G9)\n  * Over time: Learn from user behavior (G13), provide global controls (G17)\n\n\n\n**Google‚Äôs[People + AI Guidebook](https://pair.withgoogle.com/guidebook/)** is rooted in data and insights drawn from Google‚Äôs product team and academic research. In contrast to Microsoft‚Äôs guidelines which are organized around the user, Google organizes its guidelines into concepts that a developer needs to keep in mind.\n\nThere are 23 patterns grouped around common questions that come up during the product development process, including:\n\n  * How do I get started with human-centered AI: Determine if the AI adds value, invest early in good data practices (e.g., evals)\n  * How do I onboard users to new AI features: Make it safe to explore, anchor on familiarity, automate in phases\n  * How do I help users build trust in my product: Set the right expectations, be transparent, automate more when the risk is low.\n\n\n\n**Apple‚Äôs[Human Interface Guidelines for Machine Learning](https://developer.apple.com/design/human-interface-guidelines/machine-learning)** differs from the bottom-up approach of academic literature and user studies. Instead, its primary source is practitioner knowledge and experience. Thus, it doesn‚Äôt include many references or data points, but instead focuses on Apple‚Äôs longstanding design principles. This results in a unique perspective that distinguishes it from the other two guidelines.\n\nThe document focuses on how Apple‚Äôs design principles can be applied to ML-infused products, emphasizing aspects of UI rather than model functionality. It starts by asking developers to consider the role of ML in their app and work backwards from the user experience. This includes questions such as whether ML is:\n\n  * Critical or complementary: For example, Face ID cannot work without ML but the keyboard can still work without QuickType.\n  * Proactive or reactive: Siri Suggestions are proactive while autocorrect is reactive.\n  * Dynamic or static: Recommendations are dynamic while object detection in Photos only improves with each iOS release.\n\n\n\nIt then delves into several patterns, split into inputs and outputs of a system. Inputs focus on explicit feedback, implicit feedback, calibration, and corrections. This section guides the design for how AI products request and process user data and interactions. Outputs focus on mistakes, multiple options, confidence, attribution, and limitations. The intent is to ensure the model‚Äôs output is presented in a comprehensible and useful manner.\n\nThe differences between the three guidelines are insightful. Google has more emphasis on considerations for training data and model development, likely due to its engineering-driven culture. Microsoft has more focus on mental models, likely an artifact of the HCI academic study. Lastly, Apple‚Äôs approach centers around providing a seamless UX, a focus likely influenced by its cultural values and principles.\n\n### How to apply defensive UX?[](#how-to-apply-defensive-ux)\n\nHere are some patterns based on the guidelines above. (Disclaimer: I‚Äôm not a designer.)\n\n**Set the right expectations.** This principle is consistent across all three guidelines:\n\n  * Microsoft: Make clear how well the system can do what it can do (help the user understand how often the AI system may make mistakes)\n  * Google: Set the right expectations (be transparent with your users about what your AI-powered product can and cannot do)\n  * Apple: Help people establish realistic expectations (describe the limitation in marketing material or within the feature‚Äôs context)\n\n\n\nThis can be as simple as adding a brief disclaimer above AI-generated results, like those of Bard, or highlighting our app‚Äôs limitations on its landing page, like how ChatGPT does it.\n\n![Example of a disclaimer on Google Bard results \\(Note: The code provided will not work.\\)](/assets/bard-disclaimer.png)\n\nExample of a disclaimer on Google Bard results (Note: `nrows` is not a valid argument.)\n\nBy being transparent about our product‚Äôs capabilities and limitations, we help users calibrate their expectations about its functionality and output. While this may cause users to trust it less in the short run, it helps foster trust in the long run‚Äîusers are less likely to overestimate our product and subsequently face disappointment.\n\n**Enable efficient dismissal.** This is explicitly mentioned as Microsoft‚Äôs Guideline 8: Support efficient dismissal (make it easy to dismiss or ignore undesired AI system services).\n\nFor example, if a user is navigating our site and a chatbot pops up asking if they need help, it should be easy for the user to dismiss the chatbot. This ensures the chatbot doesn‚Äôt get in the way, especially on devices with smaller screens. Similarly, GitHub Copilot allows users to conveniently ignore its code suggestions by simply continuing to type. While this may reduce usage of the AI feature in the short term, it prevents it from becoming a nuisance and potentially reducing customer satisfaction in the long term.\n\n**Provide attribution.** This is listed in all three guidelines:\n\n  * Microsoft: Make clear why the system did what it did (enable the user to access an explanation of why the AI system behaved as it did)\n  * Google: Add context from human sources (help users appraise your recommendations with input from 3rd-party sources)\n  * Apple: Consider using attributions to help people distinguish among results\n\n\n\nCitations are becoming an increasingly common design element. Take BingChat for example. When we make a query, it includes citations, usually from reputable sources, in its responses. This not only shows where the information came from, but also allows users to assess the quality of the sources. Similarly, imagine we‚Äôre using an LLM to explain why a user might like a product. Alongside the LLM-generated explanation, we could include a quote from an actual review or mention the product rating.\n\nContext from experts and the community also enhances user trust. For example, if a user is seeking recommendations for a hiking trail, mentioning that a suggested trail comes highly recommended by the relevant community can go a long way. It not only adds value to the recommendation but also helps users calibrate trust through the human connection.\n\n![Example of attribution via social proof](/assets/social-proof.jpg)\n\nExample of attribution via social proof ([source](https://pair.withgoogle.com/guidebook/patterns))\n\nFinally, Apple‚Äôs guidelines include popular attributions such as ‚ÄúBecause you‚Äôve read non-fiction‚Äù, ‚ÄúNew books by authors you‚Äôve read‚Äù. These descriptors not only personalize the experience but also provide context, enhancing user understanding and trust.\n\n**Anchor on familiarity.** When introducing users to a new AI product or feature, it helps to guide them with familiar UX patterns and features. This makes it easier for users to focus on the main task and start to earn customer trust in our new product. Resist the temptation to showcase new and ‚Äúmagical‚Äù features via exotic UI elements.\n\nAlong a similar vein, chat-based features are becoming more common due to ChatGPT‚Äôs growing popularity. For example, chat with your docs, chat to query your data, chat to buy groceries. However, I [question whether chat is the right UX](/writing/llm-ux/) for most user experiences‚Äîit just takes too much effort relative to the familiar UX of clicking on text and images.\n\nFurthermore, increasing user effort leads to higher expectations that are harder to meet. Netflix shared that users have [higher expectations for recommendations](https://slideslive.com/38934788/a-human-perspective-on-algorithmic-similarity?ref=folder-59726) that result from explicit actions such as search. In general, the more effort a user puts in (e.g., chat, search), the higher the expectations they have. Contrast this with lower-effort interactions such as scrolling over recommendations slates or clicking on a product.\n\nThus, while chat offers more flexibility, it also demands more user effort. Moreover, using a chat box is less intuitive as it lacks signifiers on how users can adjust the output. Overall, I think that sticking with a familiar and constrained UI makes it easier for users to navigate our product; chat should only be considered as a secondary or tertiary option.\n\n## Collect user feedback: To build our data flywheel[](#collect-user-feedback-to-build-our-data-flywheel)\n\nGathering user feedback allows us to learn their preferences. Specific to LLM products, user feedback contributes to building evals, fine-tuning, and guardrails. If we think about it, data‚Äîsuch as corpus for pre-training, expert-crafted demonstrations, human preferences for reward modeling‚Äîis one of the few moats for LLM products. Thus, we want to be deliberately thinking about collecting user feedback when designing our UX.\n\nFeedback can be explicit or implicit. Explicit feedback is information users provide in response to a request by our product; implicit feedback is information we learn from user interactions without needing users to deliberately provide feedback.\n\n### Why collect user feedback[](#why-collect-user-feedback)\n\nUser feedback **helps our models improve**. By learning what users like, dislike, or complain about, we can improve our models to better meet their needs. It also allows us to **adapt to individual preferences**. Recommendation systems are a prime example. As users interact with items, we learn what they like and dislike and better cater to their tastes over time.\n\nIn addition, the feedback loop helps us **evaluate our system‚Äôs overall performance**. While evals can help us measure model/system performance, user feedback offers a concrete measure of user satisfaction and product effectiveness.\n\n### How to collect user feedback[](#how-to-collect-user-feedback)\n\n**Make it easy for users to provide feedback.** This is echoed across all three guidelines:\n\n  * Microsoft: Encourage granular feedback (enable the user to provide feedback indicating their preferences during regular interaction with the AI system)\n  * Google: Let users give feedback (give users the opportunity for real-time teaching, feedback, and error correction)\n  * Apple: Provide actionable information your app can use to improve the content and experience it presents to people\n\n\n\nChatGPT is one such example. Users can indicate thumbs up/down on responses, or choose to regenerate a response if it‚Äôs really bad or unhelpful. This is useful feedback on human preferences which can then be used to fine-tune LLMs.\n\nMidjourney is another good example. After images are generated, users can generate a new set of images (negative feedback), tweak an image by asking for a variation (positive feedback), or upscale and download the image (strong positive feedback). This enables Midjourney to gather rich comparison data on the outputs generated.\n\n![>Example of collecting user feedback as part of the UX](/assets/midjourney.jpg)\n\nExample of collecting user feedback as part of the UX\n\n**Consider implicit feedback too.** Implicit feedback is information that arises as users interact with our product. Unlike the specific responses we get from explicit feedback, implicit feedback can provide a wide range of data on user behavior and preferences.\n\nCopilot-like assistants are a prime example. Users indicate whether a suggestion was helpful by either wholly accepting it (strong positive feedback), accepting and making minor tweaks (positive feedback), or ignoring it (neutral/negative feedback). Alternatively, they may update the comment that led to the generated code, suggesting that the initial code generation didn‚Äôt meet their needs.\n\nChatbots, such as ChatGPT and BingChat, are another example. How has daily usage changed over time? If the product is sticky, it suggests that users like it. Also, how long is the average conversation? This can be tricky to interpret: Is a longer conversation better because the conversation was engaging and fruitful? Or is it worse because it took the user longer to get what they needed?\n\n## Other patterns common in machine learning[](#other-patterns-common-in-machine-learning)\n\nApart from the seven patterns above, there are other patterns in machine learning that are also relevant to LLM systems and products. They include:\n\n  * [Data flywheel](/writing/more-patterns/#data-flywheel-to-continuously-improve--build-a-moat): Continuous data collection improves the model and leads to a better user experience. This, in turn, promotes more usage which provides more data to further evaluate and fine-tune models, creating a virtuous cycle.\n  * [Cascade](/writing/more-patterns/#cascade-to-split-a-problem-into-smaller-problems): Rather than assigning a single, complex task to the LLM, we can simplify and break it down so it only has to handle tasks it excels at, such as reasoning or communicating eloquently. RAG is an example of this. Instead of relying on the LLM to retrieve and rank items based on its internal knowledge, we can augment LLMs with external knowledge and focus on applying the LLM‚Äôs reasoning abilities.\n  * [Monitoring](/writing/practical-guide-to-maintaining-machine-learning/#monitor-models-for-misbehaviour-when-retraining): This helps demonstrate the value added by the AI system, or the lack of it. Someone shared an anecdote of running an LLM-based customer support solution in prod for two weeks before discontinuing it‚Äîan A/B test showed that losses were 12x more when using an LLM as a substitute for their support team!\n\n\n\n(Read more about design patterns for [machine learning code](/writing/design-patterns/) and [systems](/writing/more-patterns/).)\n\nAlso, here‚Äôs what others said:\n\n> Separation of concerns/task decomposition- having distinct prompts for distinct subtasks and chaining them together helps w attention and reliability (hurts latency). We were having trouble specifying a rigid output structure AND variable response content so we split up the tasks ‚Äî [Erick Enriquez](https://twitter.com/generick_ez/status/1681153738822516736)\n\n> A few others that will be needed: role based access control: who can access what; security: if I‚Äôm using a DB with an LLM, how do I ensure that I have the right security guards ‚Äî [Krishna](https://twitter.com/ntkris/status/16812092400299991050)\n\n> Consistent output format: setting outputs to a standardized format such as JSON; Tool augmentation: offload tasks to more specialised, proven, reliable models ‚Äî [Paul Tune](https://twitter.com/ptuls/status/1681284873741561857)\n\n> Security: mitigate cache poisoning, input validation, mitigate prompt injection, training data provenance, output with non-vulnerable code, mitigate malicious input aimed at influencing requests used by tools (AI Agent), mitigate denial of service (stress test llm), to name a few :) ‚Äî [Anderson Darario](https://www.linkedin.com/feed/update/urn:li:activity:7087089908229558272?commentUrn=urn%3Ali%3Acomment%3A%28activity%3A7087089908229558272%2C7087224131292684288%29)\n\n> Another ux/ui related: incentivize users to provide feedback on generated answers (implicit or explicit). Implicit could be sth like copilot‚Äôs ghost text style, if accepted with TAB, meaning positive feedback etc. ‚Äî [Wen Yang](https://www.linkedin.com/feed/update/urn:li:activity:7087089908229558272?commentUrn=urn%3Ali%3Acomment%3A%28activity%3A7087089908229558272%2C7087149792660750336%29)\n\n> Great list. I would add consistency checks like self-consistency sampling, chaining and decomposition of tasks, and the emsembling of multiple model outputs. Applying each of these almost daily. [Dan White](https://www.threads.net/@dwhitena/post/Cu3BBaJtoyj/?igshid=OGQ5ZDc2ODk2ZA==)\n\n> Guardrails is super relevant for building analytics tools where llm is a translator from natural to programming language ‚Äî [m_voitko](https://www.threads.net/@m_voitko/post/Cu1b4liNwCS/?igshid=OGQ5ZDc2ODk2ZA==)\n\n## Conclusion[](#conclusion)\n\nThis is the longest post I‚Äôve written by far. If you‚Äôre still with me, thank you! I hope you found reading about these patterns helpful, and that the 2x2 below makes sense.\n\n![LLM patterns across the axis of data to user, and defensive to offensive.](/assets/llm-patterns.png)\n\nLLM patterns across the axis of data to user, and defensive to offensive.\n\nWe‚Äôre still so early on the journey towards building LLM-based systems and products. Are there any other key patterns or resources? What have you found useful or not useful? I‚Äôd love to hear your experience. **Please[reach out!](https://twitter.com/eugeneyan)**\n\n## References[](#references)\n\nHendrycks, Dan, et al. [‚ÄúMeasuring massive multitask language understanding.‚Äù](https://arxiv.org/abs/2009.03300) arXiv preprint arXiv:2009.03300 (2020).\n\nGao, Leo, et al. [‚ÄúA Framework for Few-Shot Language Model Evaluation.‚Äù](https://github.com/EleutherAI/lm-evaluation-harness) v0.0.1, Zenodo, (2021), doi:10.5281/zenodo.5371628.\n\nLiang, Percy, et al. [‚ÄúHolistic evaluation of language models.‚Äù](https://arxiv.org/abs/2211.09110) arXiv preprint arXiv:2211.09110 (2022).\n\nDubois, Yann, et al. [‚ÄúAlpacaFarm: A Simulation Framework for Methods That Learn from Human Feedback.‚Äù](https://github.com/tatsu-lab/alpaca_eval) (2023)\n\nPapineni, Kishore, et al. [‚ÄúBleu: a method for automatic evaluation of machine translation.‚Äù](https://dl.acm.org/doi/10.3115/1073083.1073135) Proceedings of the 40th annual meeting of the Association for Computational Linguistics. 2002.\n\nLin, Chin-Yew. [‚ÄúRouge: A package for automatic evaluation of summaries.‚Äù](https://aclanthology.org/W04-1013/) Text summarization branches out. 2004.\n\nZhang, Tianyi, et al. [‚ÄúBertscore: Evaluating text generation with bert.‚Äù](https://arxiv.org/abs/1904.09675) arXiv preprint arXiv:1904.09675 (2019).\n\nZhao, Wei, et al. [‚ÄúMoverScore: Text generation evaluating with contextualized embeddings and earth mover distance.‚Äù](https://arxiv.org/abs/1909.02622) arXiv preprint arXiv:1909.02622 (2019).\n\nSai, Ananya B., Akash Kumar Mohankumar, and Mitesh M. Khapra. [‚ÄúA survey of evaluation metrics used for NLG systems.‚Äù](https://arxiv.org/abs/2008.12009) ACM Computing Surveys (CSUR) 55.2 (2022): 1-39.\n\nGrusky, Max. [‚ÄúRogue Scores.‚Äù](https://aclanthology.org/2023.acl-long.107/) Proceedings of the 61st Annual Meeting of the Association for Computational Linguistics (Volume 1: Long Papers). 2023.\n\nLiu, Yang, et al. [‚ÄúGpteval: Nlg evaluation using gpt-4 with better human alignment.‚Äù](https://arxiv.org/abs/2303.16634) arXiv preprint arXiv:2303.16634 (2023).\n\nFourrier, Cl√©mentine, et al. [‚ÄúWhat‚Äôs going on with the Open LLM Leaderboard?‚Äù](https://huggingface.co/blog/evaluating-mmlu-leaderboard#whats-going-on-with-the-open-llm-leaderboard) (2023).\n\nZheng, Lianmin, et al. [‚ÄúJudging LLM-as-a-judge with MT-Bench and Chatbot Arena.‚Äù](https://arxiv.org/abs/2306.05685) arXiv preprint arXiv:2306.05685 (2023).\n\nDettmers, Tim, et al. [‚ÄúQlora: Efficient finetuning of quantized llms.‚Äù](https://arxiv.org/abs/2305.14314) arXiv preprint arXiv:2305.14314 (2023).\n\nSwyx et al. [MPT-7B and The Beginning of Context=Infinity](https://www.latent.space/p/mosaic-mpt-7b#details) (2023).\n\nFradin, Michelle, Reeder, Lauren [‚ÄúThe New Language Model Stack‚Äù](https://www.sequoiacap.com/article/llm-stack-perspective/) (2023).\n\nRadford, Alec, et al. [‚ÄúLearning transferable visual models from natural language supervision.‚Äù](https://arxiv.org/abs/2103.00020) International conference on machine learning. PMLR, 2021.\n\nYan, Ziyou. [‚ÄúSearch: Query Matching via Lexical, Graph, and Embedding Methods.‚Äù](https://eugeneyan.com/writing/search-query-matching/) eugeneyan.com, (2021).\n\nPetroni, Fabio, et al. [‚ÄúHow context affects language models‚Äô factual predictions.‚Äù](https://arxiv.org/abs/2005.04611) arXiv preprint arXiv:2005.04611 (2020).\n\nKarpukhin, Vladimir, et al. [‚ÄúDense passage retrieval for open-domain question answering.‚Äù](https://arxiv.org/abs/2004.04906) arXiv preprint arXiv:2004.04906 (2020).\n\nLewis, Patrick, et al. [‚ÄúRetrieval-augmented generation for knowledge-intensive nlp tasks.‚Äù](https://arxiv.org/abs/2005.11401) Advances in Neural Information Processing Systems 33 (2020): 9459-9474.\n\nIzacard, Gautier, and Edouard Grave. [‚ÄúLeveraging passage retrieval with generative models for open domain question answering.‚Äù](https://arxiv.org/abs/2007.01282) arXiv preprint arXiv:2007.01282 (2020).\n\nBorgeaud, Sebastian, et al. [‚ÄúImproving language models by retrieving from trillions of tokens.‚Äù](https://arxiv.org/abs/2112.04426) International conference on machine learning. PMLR, (2022).\n\nLazaridou, Angeliki, et al. [‚ÄúInternet-augmented language models through few-shot prompting for open-domain question answering.‚Äù](https://arxiv.org/abs/2203.05115) arXiv preprint arXiv:2203.05115 (2022).\n\nWang, Yue, et al. [‚ÄúCodet5+: Open code large language models for code understanding and generation.‚Äù](https://arxiv.org/abs/2305.07922) arXiv preprint arXiv:2305.07922 (2023).\n\nGao, Luyu, et al. [‚ÄúPrecise zero-shot dense retrieval without relevance labels.‚Äù](https://arxiv.org/abs/2212.10496) arXiv preprint arXiv:2212.10496 (2022).\n\nYan, Ziyou. [‚ÄúObsidian-Copilot: An Assistant for Writing & Reflecting.‚Äù](https://eugeneyan.com/writing/obsidian-copilot/) eugeneyan.com, (2023).\n\nBojanowski, Piotr, et al. [‚ÄúEnriching word vectors with subword information.‚Äù](https://arxiv.org/abs/1607.04606) Transactions of the association for computational linguistics 5 (2017): 135-146.\n\nReimers, Nils, and Iryna Gurevych. [‚ÄúMaking Monolingual Sentence Embeddings Multilingual Using Knowledge Distillation.‚Äù](https://arxiv.org/abs/2004.09813) Proceedings of the 2020 Conference on Empirical Methods in Natural Language Processing, Association for Computational Linguistics, (2020).\n\nWang, Liang, et al. [‚ÄúText embeddings by weakly-supervised contrastive pre-training.‚Äù](https://arxiv.org/abs/2212.03533) arXiv preprint arXiv:2212.03533 (2022).\n\nSu, Hongjin, et al. [‚ÄúOne embedder, any task: Instruction-finetuned text embeddings.‚Äù](https://arxiv.org/abs/2212.09741) arXiv preprint arXiv:2212.09741 (2022).\n\nJohnson, Jeff, et al. [‚ÄúBillion-Scale Similarity Search with GPUs.‚Äù](https://arxiv.org/abs/1702.08734) IEEE Transactions on Big Data, vol. 7, no. 3, IEEE, 2019, pp. 535‚Äì47.\n\nMalkov, Yu A., and Dmitry A. Yashunin. [‚ÄúEfficient and Robust Approximate Nearest Neighbor Search Using Hierarchical Navigable Small World Graphs.‚Äù](https://arxiv.org/abs/1603.09320) IEEE Transactions on Pattern Analysis and Machine Intelligence, vol. 42, no. 4, IEEE, 2018, pp. 824‚Äì36.\n\nGuo, Ruiqi, et al. [‚ÄúAccelerating Large-Scale Inference with Anisotropic Vector Quantization.‚Äù](https://arxiv.org/abs/1908.10396.) International Conference on Machine Learning, (2020)\n\nOuyang, Long, et al. [‚ÄúTraining language models to follow instructions with human feedback.‚Äù](https://arxiv.org/abs/2203.02155) Advances in Neural Information Processing Systems 35 (2022): 27730-27744.\n\nHoward, Jeremy, and Sebastian Ruder. [‚ÄúUniversal language model fine-tuning for text classification.‚Äù](https://arxiv.org/abs/1801.06146) arXiv preprint arXiv:1801.06146 (2018).\n\nDevlin, Jacob, et al. [‚ÄúBert: Pre-training of deep bidirectional transformers for language understanding.‚Äù](https://arxiv.org/abs/1810.04805) arXiv preprint arXiv:1810.04805 (2018).\n\nRadford, Alec, et al. [‚ÄúImproving language understanding with unsupervised learning.‚Äù](https://openai.com/research/language-unsupervised) (2018).\n\nRaffel, Colin, et al. [‚ÄúExploring the limits of transfer learning with a unified text-to-text transformer.‚Äù](https://arxiv.org/abs/1910.10683) The Journal of Machine Learning Research 21.1 (2020): 5485-5551.\n\nLester, Brian, Rami Al-Rfou, and Noah Constant. [‚ÄúThe power of scale for parameter-efficient prompt tuning.‚Äù](https://arxiv.org/abs/2104.08691) arXiv preprint arXiv:2104.08691 (2021).\n\nLi, Xiang Lisa, and Percy Liang. [‚ÄúPrefix-tuning: Optimizing continuous prompts for generation.‚Äù](https://arxiv.org/abs/2101.00190) arXiv preprint arXiv:2101.00190 (2021).\n\nHoulsby, Neil, et al. [‚ÄúParameter-efficient transfer learning for NLP.‚Äù](https://arxiv.org/abs/1902.00751) International Conference on Machine Learning. PMLR, 2019.\n\nHu, Edward J., et al. [‚ÄúLora: Low-rank adaptation of large language models.‚Äù](https://arxiv.org/abs/2106.09685) arXiv preprint arXiv:2106.09685 (2021).\n\nDettmers, Tim, et al. [‚ÄúQlora: Efficient finetuning of quantized llms.‚Äù](https://arxiv.org/abs/2305.14314) arXiv preprint arXiv:2305.14314 (2023).\n\nWilliams, Adina, et al. [‚ÄúA Broad-Coverage Challenge Corpus for Sentence Understanding through Inference.‚Äù](https://cims.nyu.edu/~sbowman/multinli/) Proceedings of the 2018 Conference of the North American Chapter of the Association for Computational Linguistics: Human Language Technologies, Volume 1 (Long Papers), Association for Computational Linguistics, (2018).\n\n[GPTCache](https://github.com/zilliztech/GPTCache) (2023).\n\nBai, Yuntao, et al. [‚ÄúTraining a helpful and harmless assistant with reinforcement learning from human feedback.‚Äù](https://arxiv.org/abs/2204.05862) arXiv preprint arXiv:2204.05862 (2022).\n\n[Guardrails](https://github.com/ShreyaR/guardrails) (2023)\n\n[NeMo-Guardrails](https://github.com/NVIDIA/NeMo-Guardrails) (2023)\n\nManakul, Potsawee, Adian Liusie, and Mark JF Gales. [‚ÄúSelfcheckgpt: Zero-resource black-box hallucination detection for generative large language models.‚Äù](https://arxiv.org/abs/2303.08896) arXiv preprint arXiv:2303.08896 (2023).\n\n[Guidance](https://github.com/microsoft/guidance) (2023).\n\nAmershi, Saleema, et al. [‚ÄúGuidelines for human-AI interaction.‚Äù](https://www.microsoft.com/en-us/research/publication/guidelines-for-human-ai-interaction/) Proceedings of the 2019 chi conference on human factors in computing systems. 2019.\n\n[People + AI Guidebook](https://pair.withgoogle.com/guidebook/) (2023).\n\n[Human Interface Guidelines for Machine Learning](https://developer.apple.com/design/human-interface-guidelines/machine-learning) (2023).\n\nSchendel, Zachary A., Faraz Farzin, and Siddhi Sundar. [‚ÄúA Human Perspective on Algorithmic Similarity.‚Äù](https://slideslive.com/38934788/a-human-perspective-on-algorithmic-similarity?ref=folder-59726) Proceedings of the 14th ACM Conference on Recommender Systems. 2020.\n\nIf you found this useful, please cite this write-up as:\n\n> Yan, Ziyou. (Jul 2023). Patterns for Building LLM-based Systems & Products. eugeneyan.com. https://eugeneyan.com/writing/llm-patterns/.\n\nor\n\n```\n`@article{yan2023llm-patterns, title = {Patterns for Building LLM-based Systems & Products}, author = {Yan, Ziyou}, journal = {eugeneyan.com}, year = {2023}, month = {Jul}, url = {https://eugeneyan.com/writing/llm-patterns/} }`\n```\n\nShare on: \n\n![](/assets/icon-twitter.svg)\n\n![](/assets/icon-linkedin.svg)\n\n![](/assets/icon-facebook.svg)\n\n![](/assets/icon-mail.svg)\n\nBrowse related tags: [ [llm](/tag/llm/) [engineering](/tag/engineering/) [production](/tag/production/) [üî•](/tag/üî•/) ] \n\n[ ![](/assets/icon-search.svg)Search](/search/ \"Search\")\n\n[¬´ Obsidian-Copilot: An Assistant for Writing & Reflecting](/writing/obsidian-copilot/) [How to Match LLM Patterns to Problems ¬ª](/writing/llm-problems/)\n\nJoin **9,800+** readers getting updates on machine learning, RecSys, LLMs, and engineering.\n\nGet email updates\n\n  * ![](/assets/bluesky.svg) [Bluesky](https://bsky.app/profile/eugeneyan.bsky.social \"Bluesky\")\n  * ![](/assets/icon-twitter.svg) [Twitter](https://twitter.com/eugeneyan \"Twitter\")\n  * ![](/assets/icon-linkedin.svg) [LinkedIn](https://www.linkedin.com/in/eugeneyan/ \"Linkedin\")\n  * ![](/assets/icon-github.svg) [GitHub](https://github.com/eugeneyan/ \"GitHub\")\n\n\n\nEugene Yan designs, builds, and operates machine learning systems that serve customers at scale. He's currently a Senior Applied Scientist at Amazon. Previously, he led machine learning at Lazada (acquired by Alibaba) and a Healthtech Series A. He [writes](/writing/) & [speaks](/speaking/) about machine learning, recommenders, LLMs, and engineering at [eugeneyan.com](https://eugeneyan.com/) and [ApplyingML.com](https://applyingml.com/). \n\n¬© Eugene Yan 2015 - 2025 ‚Ä¢ [Feedback](/site-feedback/) ‚Ä¢ [RSS](/rss/)\n",
    "content_quality_score": null,
    "summary": null,
    "child_urls": [
        "https://eugeneyan.com/",
        "https://eugeneyan.com/start-here/",
        "https://eugeneyan.com/writing/",
        "https://eugeneyan.com/speaking/",
        "https://eugeneyan.com/prototyping/",
        "https://eugeneyan.com/about/",
        "https://eugeneyan.com/tag/llm/",
        "https://eugeneyan.com/tag/engineering/",
        "https://eugeneyan.com/tag/production/",
        "https://eugeneyan.com/tag/üî•/",
        "https://eugeneyan.com/writing/llm-patterns/#evals-to-measure-performance",
        "https://eugeneyan.com/writing/llm-patterns/#retrieval-augmented-generation-to-add-knowledge",
        "https://eugeneyan.com/writing/llm-patterns/#fine-tuning-to-get-better-at-specific-tasks",
        "https://eugeneyan.com/writing/llm-patterns/#caching-to-reduce-latency-and-cost",
        "https://eugeneyan.com/writing/llm-patterns/#guardrails-to-ensure-output-quality",
        "https://eugeneyan.com/writing/llm-patterns/#defensive-ux-to-anticipate--handle-errors-gracefully",
        "https://eugeneyan.com/writing/llm-patterns/#collect-user-feedback-to-build-our-data-flywheel",
        "https://eugeneyan.com/writing/llm-problems/",
        "https://eugeneyan.com/writing/llm-patterns/#conclusion",
        "https://eugeneyan.com/writing/llm-patterns/#why-evals",
        "https://eugeneyan.com/writing/llm-patterns/#more-about-evals",
        "https://eugeneyan.com/writing/llm-patterns/#how-to-apply-evals",
        "https://eugeneyan.com/writing/abstractive/",
        "https://eugeneyan.com/writing/llm-patterns/#why-rag",
        "https://eugeneyan.com/writing/llm-patterns/#more-about-rag",
        "https://eugeneyan.com/writing/search-query-matching/#supervised-techniques-improves-modeling-of-our-desired-event",
        "https://eugeneyan.com/writing/search-query-matching/#self-supervised-techniques-no-need-for-labels",
        "https://eugeneyan.com/writing/llm-patterns/#how-to-apply-rag",
        "https://eugeneyan.com/writing/obsidian-copilot/",
        "https://eugeneyan.com/writing/real-time-recommendations/#how-to-design-and-implement-an-mvp",
        "https://eugeneyan.com/writing/llm-patterns/#why-fine-tuning",
        "https://eugeneyan.com/writing/llm-patterns/#more-about-fine-tuning",
        "https://eugeneyan.com/writing/image-categorization-is-now-live/",
        "https://eugeneyan.com/writing/image-search-is-now-live/",
        "https://eugeneyan.com/writing/llm-patterns/#how-to-apply-fine-tuning",
        "https://eugeneyan.com/writing/labeling-guidelines/",
        "https://eugeneyan.com/writing/llm-patterns/#evals-to-measure-performance-scalably",
        "https://eugeneyan.com/writing/llm-patterns/#why-caching",
        "https://eugeneyan.com/writing/llm-patterns/#more-about-caching",
        "https://eugeneyan.com/writing/llm-patterns/#how-to-apply-caching",
        "https://eugeneyan.com/writing/llm-patterns/#why-guardrails",
        "https://eugeneyan.com/writing/llm-patterns/#more-about-guardrails",
        "https://eugeneyan.com/writing/llm-patterns/#how-to-apply-guardrails",
        "https://eugeneyan.com/writing/llm-patterns/#why-defensive-ux",
        "https://eugeneyan.com/writing/llm-patterns/#more-about-defensive-ux",
        "https://eugeneyan.com/writing/llm-patterns/#how-to-apply-defensive-ux",
        "https://eugeneyan.com/writing/llm-ux/",
        "https://eugeneyan.com/writing/llm-patterns/#why-collect-user-feedback",
        "https://eugeneyan.com/writing/llm-patterns/#how-to-collect-user-feedback",
        "https://eugeneyan.com/writing/llm-patterns/#other-patterns-common-in-machine-learning",
        "https://eugeneyan.com/writing/more-patterns/#data-flywheel-to-continuously-improve--build-a-moat",
        "https://eugeneyan.com/writing/more-patterns/#cascade-to-split-a-problem-into-smaller-problems",
        "https://eugeneyan.com/writing/practical-guide-to-maintaining-machine-learning/#monitor-models-for-misbehaviour-when-retraining",
        "https://eugeneyan.com/writing/design-patterns/",
        "https://eugeneyan.com/writing/more-patterns/",
        "https://eugeneyan.com/writing/llm-patterns/#references",
        "https://eugeneyan.com/writing/search-query-matching/",
        "https://eugeneyan.com/search/",
        "https://eugeneyan.com/site-feedback/",
        "https://eugeneyan.com/rss/",
        "https://news.ycombinator.com/item?id=36965993",
        "https://twitter.com/eugeneyan/status/1686531758701899776",
        "https://www.linkedin.com/posts/eugeneyan_patterns-for-building-llm-based-systems-activity-7092300473981927424-_wVo",
        "https://twitter.com/eugeneyan/status/1672692174704766976",
        "https://news.ycombinator.com/item?id=36789901",
        "https://arxiv.org/abs/2009.03300",
        "https://github.com/EleutherAI/lm-evaluation-harness",
        "https://arxiv.org/abs/2211.09110",
        "https://github.com/tatsu-lab/alpaca_eval",
        "https://dl.acm.org/doi/10.3115/1073083.1073135",
        "https://aclanthology.org/W04-1013/",
        "https://arxiv.org/abs/1904.09675",
        "https://arxiv.org/abs/1909.02622",
        "https://arxiv.org/abs/2008.12009",
        "https://arxiv.org/abs/2303.16634",
        "https://aclanthology.org/2023.acl-long.107/",
        "https://huggingface.co/blog/evaluating-mmlu-leaderboard",
        "https://twitter.com/Tim_Dettmers/status/1673446047266504704",
        "https://arxiv.org/abs/2306.05685",
        "https://arxiv.org/abs/2305.14314",
        "https://twitter.com/Tim_Dettmers/status/1680782418335367169",
        "https://arxiv.org/abs/2107.03374",
        "https://www.latent.space/p/mosaic-mpt-7b#details",
        "https://www.sequoiacap.com/article/llm-stack-perspective/",
        "https://huggingface.co/spaces/mteb/leaderboard",
        "https://arxiv.org/abs/2103.00020",
        "https://arxiv.org/abs/2005.04611",
        "https://arxiv.org/abs/2004.04906",
        "https://arxiv.org/abs/2005.11401",
        "https://arxiv.org/abs/2007.01282",
        "https://arxiv.org/abs/2112.04426",
        "https://arxiv.org/abs/2203.05115",
        "https://arxiv.org/abs/2305.07922",
        "https://arxiv.org/abs/2212.10496",
        "https://openai.com/blog/new-and-improved-embedding-model",
        "https://fasttext.cc",
        "https://github.com/UKPLab/sentence-transformers",
        "https://arxiv.org/abs/2212.03533",
        "https://arxiv.org/abs/2212.09741",
        "https://huggingface.co/thenlper/gte-large",
        "https://twitter.com/NirantK",
        "https://en.wikipedia.org/wiki/Locality-sensitive_hashing",
        "https://github.com/facebookresearch/faiss",
        "https://github.com/nmslib/hnswlib",
        "https://github.com/google-research/google-research/tree/master/scann",
        "https://arxiv.org/abs/2203.02155",
        "https://arxiv.org/abs/1801.06146",
        "https://arxiv.org/abs/1810.04805",
        "https://s3-us-west-2.amazonaws.com/openai-assets/research-covers/language-unsupervised/language_understanding_paper.pdf",
        "https://s3-us-west-2.amazonaws.com/openai-assets/research-covers/language-unsupervised/language_understanding_paper.pd",
        "https://arxiv.org/abs/1910.10683",
        "https://arxiv.org/abs/2104.08691",
        "https://arxiv.org/abs/2101.00190",
        "https://arxiv.org/abs/1902.00751",
        "https://arxiv.org/abs/2106.09685",
        "https://arxiv.org/abs/2012.13255",
        "https://cims.nyu.edu/~sbowman/multinli/",
        "https://openai.com/policies/terms-of-use",
        "https://ai.meta.com/llama/license/",
        "https://github.com/eugeneyan/open-llms",
        "https://twitter.com/HanchungLee/status/1681146845186363392",
        "https://aws.amazon.com/caching/",
        "https://aws.amazon.com/caching/best-practices/",
        "https://github.com/zilliztech/GPTCache",
        "https://www.youtube.com/live/9VgpXcfJYvw?feature=share&t=1517",
        "https://www.cnbc.com/2023/06/12/amazon-is-using-generative-ai-to-summarize-product-reviews.html",
        "https://cheatlayer.com",
        "https://arxiv.org/abs/2204.05862",
        "https://github.com/ShreyaR/guardrails",
        "https://github.com/ShreyaR/guardrails/blob/main/guardrails/validators.py",
        "https://github.com/NVIDIA/NeMo-Guardrails",
        "https://arxiv.org/abs/2303.08896",
        "https://github.com/microsoft/guidance",
        "https://github.com/ShreyaR/guardrails/blob/main/guardrails/constants.xml#L14",
        "https://handlebarsjs.com",
        "https://github.com/microsoft/guidance#guaranteeing-valid-syntax-json-example-notebook",
        "https://github.com/microsoft/guidance#rich-output-structure-example-notebook",
        "https://github.com/microsoft/guidance#role-based-chat-model-example-notebook",
        "https://github.com/microsoft/guidance#agents-notebook",
        "https://github.com/microsoft/guidance#token-healing-notebook",
        "https://github.com/LDNOOBW/List-of-Dirty-Naughty-Obscene-and-Otherwise-Bad-Words",
        "https://pypi.org/project/profanity-check/",
        "https://twitter.com/goodside/status/1685023251532320768",
        "https://www.microsoft.com/en-us/research/publication/guidelines-for-human-ai-interaction/",
        "https://www.microsoft.com/en-us/research/project/guidelines-for-human-ai-interaction/",
        "https://pair.withgoogle.com/guidebook/",
        "https://developer.apple.com/design/human-interface-guidelines/machine-learning",
        "https://pair.withgoogle.com/guidebook/patterns",
        "https://slideslive.com/38934788/a-human-perspective-on-algorithmic-similarity?ref=folder-59726",
        "https://twitter.com/generick_ez/status/1681153738822516736",
        "https://twitter.com/ntkris/status/16812092400299991050",
        "https://twitter.com/ptuls/status/1681284873741561857",
        "https://www.linkedin.com/feed/update/urn:li:activity:7087089908229558272?commentUrn=urn%3Ali%3Acomment%3A%28activity%3A7087089908229558272%2C7087224131292684288%29",
        "https://www.linkedin.com/feed/update/urn:li:activity:7087089908229558272?commentUrn=urn%3Ali%3Acomment%3A%28activity%3A7087089908229558272%2C7087149792660750336%29",
        "https://www.threads.net/@dwhitena/post/Cu3BBaJtoyj/?igshid=OGQ5ZDc2ODk2ZA==",
        "https://www.threads.net/@m_voitko/post/Cu1b4liNwCS/?igshid=OGQ5ZDc2ODk2ZA==",
        "https://twitter.com/eugeneyan",
        "https://huggingface.co/blog/evaluating-mmlu-leaderboard#whats-going-on-with-the-open-llm-leaderboard",
        "https://arxiv.org/abs/1607.04606",
        "https://arxiv.org/abs/2004.09813",
        "https://arxiv.org/abs/1702.08734",
        "https://arxiv.org/abs/1603.09320",
        "https://arxiv.org/abs/1908.10396.",
        "https://openai.com/research/language-unsupervised",
        "https://bsky.app/profile/eugeneyan.bsky.social",
        "https://www.linkedin.com/in/eugeneyan/",
        "https://github.com/eugeneyan/",
        "https://applyingml.com/"
    ]
}